"8388",45.087,"PA","Crawford County","CAMBRIDGE AREA VOLUNTEER AMBULANCE SERVICE INC",0.045087
"8389",184171.333,"PA","Cumberland County","MESSIAH HOME",184.171333
"8390",91499.514,"PA","Cumberland County","PARTNERSHIP FOR BETTER HEALTH",91.499514
"8391",72252.566,"PA","Cumberland County","UNIQUESOURCE PRODUCTS & SERVICES",72.252566
"8392",28664.704,"PA","Cumberland County","UNITED WAY OF THE CAPITAL REGION",28.664704
"8393",16301.807,"PA","Cumberland County","YOUNG MENS CHRISTIAN ASSOCIATION",16.301807
"8394",14233.667,"PA","Cumberland County","MESSIAH FAMILY SERVICES",14.233667
"8395",9229.64,"PA","Cumberland County","PENNSYLVANIA EDUCATIONAL COMMUNICATIONS SYSTEMS",9.22964
"8396",8341.698,"PA","Cumberland County","FAMILY HEALTH COUNCIL OF CENTRAL PA INC",8.341698
"8397",6520.751,"PA","Cumberland County","UNITED WAY FOUNDATION OF THE CAPITAL REGION",6.520751
"8398",5781.755,"PA","Cumberland County","PENNSYLVANIA ASSOC OF COMMUNITY HEALTH CENTERS",5.781755
"8399",19184.738,"PA","Dauphin County","VISION RESOURCES OF CENTRAL PENNSYLVANIA",19.184738
"8400",18330.788,"PA","Dauphin County","YWCA GREATER HARRISBURG",18.330788
"8401",15180.246,"PA","Dauphin County","MIDPENN LEGAL SERVICES INC",15.180246
"8402",12935.232,"PA","Dauphin County","HARRISBURG SYMPHONY ASSOCIATION",12.935232
"8403",10933.847,"PA","Dauphin County","PENNSYLVANIAS STATE SYSTEM OF HIGHER EDUCATION FOUNDATION",10.933847
"8404",6121.264,"PA","Dauphin County","PAXTON STREET HOME BENEVOLENT SOCIETY INC",6.121264
"8405",5328.979,"PA","Dauphin County","PENNSYLVANIA ASSOCIATION FOR THE BLIND",5.328979
"8406",4696.602,"PA","Dauphin County","CITIZENS FOR PENNSYLVANIAS FUTURE",4.696602
"8407",4412.26,"PA","Dauphin County","PENNSYLVANIA LEGAL AID NETWORK",4.41226
"8408",3580.15,"PA","Dauphin County","JOSHUA GROUP",3.58015
"8409",241019.068,"PA","Delaware County","WILLIAMSON COLLEGE OF THE TRADES",241.019068
"8410",14487.901,"PA","Delaware County","OPERATION WARM INC",14.487901
"8411",13982.29,"PA","Delaware County","JOHN J TYLER ARBORETUM",13.98229
"8412",11180.033,"PA","Delaware County","J WOOD PLATT CADDIE SCHOLARSHIP TRUST",11.180033
"8413",6358.669,"PA","Delaware County","DELAWARE COUNTY COMMUNITY COLLEGE EDUCATIONAL FOUNDATION",6.358669
"8414",6155.112,"PA","Delaware County","SCHOOL IN ROSE VALLEY",6.155112
"8415",5875.496,"PA","Delaware County","BETHESDA HOUSE CORP",5.875496
"8416",3565.588,"PA","Delaware County","CHRISTIAN ACADEMY FOUNDATION",3.565588
"8417",3319.611,"PA","Delaware County","DREXEL NEUMANN ACADEMY",3.319611
"8418",3300.192,"PA","Delaware County","MEDIA-PROVIDENCE FRIENDS SCHOOL",3.300192
"8419",20194.371,"PA","Elk County","ELCAM INC",20.194371
"8420",1500.45,"PA","Elk County","CITIZENS AGAINST PHYSICAL SEXUAL AND EMOTIONAL ABUSE INC",1.50045
"8421",1183.817,"PA","Elk County","RIDGWAY FIRE DEPARTMENT INC",1.183817
"8422",96.725,"PA","Elk County","ELCO HOUSING INC",0.096725
"8423",36986.911,"PA","Erie County","EDINBORO UNIVERSITY FOUNDATION",36.986911
"8424",14868.161,"PA","Erie County","LAKESHORE COMMUNITY SERVICES INC",14.868161
"8425",7839.39,"PA","Erie County","MERCY CENTER FOR WOMEN INC",7.83939
"8426",7686.716,"PA","Erie County","PUBLIC BROADCASTING OF NORTHWEST PENNSYLVANIA INC",7.686716
"8427",5529.916,"PA","Erie County","ERIE DAY SCHOOL INC",5.529916
"8428",5074.102,"PA","Erie County","CRIME VICTIM CENTER OF ERIE COUNTY INC",5.074102
"8429",4870.5,"PA","Erie County","COMMUNITY BLOOD BANK OF ERIE COUNTY",4.8705
"8430",4654.215,"PA","Erie County","ST PAULS CLINIC FOUNDATION",4.654215
"8431",3556.668,"PA","Erie County","BENETWOOD CORPORATION",3.556668
"8432",3031.083,"PA","Erie County","EDINBORO UNIVERSITY ALUMNI ASSOC",3.031083
"8433",5644.918,"PA","Fayette County","LAUREL HOUSE INCORPORATED",5.644918
"8434",1579.286,"PA","Fayette County","ANOTHER WAY INC",1.579286
"8435",1054.043,"PA","Fayette County","GOOD WORKS MINISTRIES",1.054043
"8436",852.949,"PA","Fayette County","FAYETTE COUNTY DRUG & ALCOHOL COMMISSION",0.852949
"8437",138.965,"PA","Fayette County","CONNELLSVILLE AREA SENIOR TIGERS INC",0.138965
"8438",107.233,"PA","Fayette County","CHESTNUT RIDGE CHRISTIAN ACADEMY INC",0.107233
"8439",16712.459,"PA","Franklin County","FOLIUM INC",16.712459
"8440",6108.062,"PA","Franklin County","YOUNG MENS CHRISTIAN ASSOC",6.108062
"8441",4664.433,"PA","Franklin County","WOMEN IN NEED INC",4.664433
"8442",1523.014,"PA","Franklin County","CHRISTIAN RESIDENTIAL OPPORTUNITIES AND SOCIAL SERVICES INC",1.523014
"8443",988.529,"PA","Franklin County","MAINSTREET WAYNESBORO INC",0.988529
"8444",860.647,"PA","Franklin County","TUSCARORA WILDLIFE EDUCATION PROJECT INC",0.860647
"8445",842.211,"PA","Franklin County","COVE VALLEY CHRISTIAN YOUTH CAMP",0.842211
"8446",728.279,"PA","Franklin County","PROVIDENCE CHRISTIAN ACADEMY",0.728279
"8447",549.619,"PA","Franklin County","WAYNESBORO HISTORICAL SOCIETY",0.549619
"8448",483.845,"PA","Franklin County","FRANKLIN COUNTY FIRE CHIEFS ASSOCIATION INC",0.483845
"8449",668.811,"PA","Fulton County","MCCONNELLSBURG RECREATION CENTER INC",0.668811
"8450",575.878,"PA","Greene County","SECOND SAM NINE",0.575878
"8451",49845.099,"PA","Huntingdon County","GRIER FOUNDATION",49.845099
"8452",8422.716,"PA","Huntingdon County","BROAD TOP AREA MEDICAL CENTER INC",8.422716
"8453",1480.442,"PA","Huntingdon County","STONE VALLEY COMMUNITY CHARTER SCHOOL INC",1.480442
"8454",1206.731,"PA","Huntingdon County","HUNTINGDON COUNTY AGRICULTURAL ASSN INC",1.206731
"8455",1054.382,"PA","Huntingdon County","HUNTINGDON COUNTY CHAMBER FOUNDATION",1.054382
"8456",581.434,"PA","Huntingdon County","FRIENDS OF GOLDEN POND",0.581434
"8457",219.652,"PA","Huntingdon County","HUNTINGDON AREA SCHOOL DISTRICT EDUCATIONAL FOUNDATION",0.219652
"8458",167.554,"PA","Huntingdon County","HUNTINGDON HOUSE A PROGRAM FOR VICTIMS OF DOMESTIC VIOLENCE",0.167554
"8459",233405.899,"PA","Indiana County","FOUNDATION FOR INDIANA UNIVERSITY OF PENNSYLVANIA",233.405899
"8460",86358.571,"PA","Indiana County","RESIDENTIAL REVIVAL INDIANA",86.358571
"8461",28893.761,"PA","Indiana County","STUDENT COOPERATIVE ASSOCIATION INC",28.893761
"8462",6672.876,"PA","Indiana County","INDIANA UNIVERSITY OF PENNSYLVANIA ALUMNI ASSOCIATION",6.672876
"8463",3183.129,"PA","Indiana County","INDIANA COUNTY HEAD START INC COUNTY",3.183129
"8464",561.76,"PA","Indiana County","PENNS MANOR FOUNDATION",0.56176
"8465",528.831,"PA","Indiana County","SEEDS OF FAITH CHRISTIAN ACADEMY",0.528831
"8466",418.87,"PA","Indiana County","INDIANA COUNTY CHILD DAY CARE PROGRAM INC",0.41887
"8467",242.132,"PA","Indiana County","AMERICAN DRIVER AND TRAFFIC SAFETY EDUCATION ASSOCIATION",0.242132
"8468",180.569,"PA","Indiana County","THE ARC OF INDIANA COUNTY",0.180569
"8469",4580.773,"PA","Jefferson County","JEFFERSON COUNTY AREA AGENCY ON AGING",4.580773
"8470",2704.317,"PA","Jefferson County","LIFESPAN FAMILY SERVICES OF PA",2.704317
"8471",2508.247,"PA","Jefferson County","COMMUNITY ACTION INC",2.508247
"8472",1324.575,"PA","Jefferson County","BROCKWAY AREA AMBULANCE SERVICE INC",1.324575
"8473",1051.343,"PA","Jefferson County","BROOKVILLE VOLUNTEER FIRE CO",1.051343
"8474",753.429,"PA","Jefferson County","BROCKWAY CENTER FOR ARTS AND TECHNOLOGY",0.753429
"8475",409.234,"PA","Jefferson County","BROCKWAY TELEVISION INC",0.409234
"8476",1432.189,"PA","Juniata County","CENTRAL PENNSYLVANIA YOUTH MINISTRIES",1.432189
"8477",57188.252,"PA","Lackawanna County","NORTHEAST PENNSYLVANIA CENTER FOR INDEPENDENT LIVING",57.188252
"8478",38728.475,"PA","Lackawanna County","O S JOHNSON SCHOOL OF TECHNOLOGY",38.728475
"8479",24605.423,"PA","Lackawanna County","SCRANTON COUNSELING CENTER",24.605423
"8480",6631.442,"PA","Lackawanna County","METRO-ACTION INC CHAMBER OF COMMERCE BLDG",6.631442
"8481",4730.354,"PA","Lackawanna County","COMMUNITY SUPPORT GROUP",4.730354
"8482",4439.49,"PA","Lackawanna County","DRUG & ALCOHOL TREATMENT SERVICE",4.43949
"8483",4267.648,"PA","Lackawanna County","BOYS AND GIRLS CLUB OF NORTHEASTERN PENNSYLVANIA FOUNDATION",4.267648
"8484",3610.745,"PA","Lackawanna County","LACKAWANNA BLIND ASSOCIATION",3.610745
"8485",1574.559,"PA","Lackawanna County","BOYS & GIRLS CLUBS OF NORTHEASTERN PENNSYLVANIA",1.574559
"8486",1030.62,"PA","Lackawanna County","SCRANTON LACKAWANNA RESOURCES DEVELOPMENT CORPORATION",1.03062
"8487",128245.313,"PA","Lancaster County","BEYOND OWNERS GROUP INC",128.245313
"8488",59715.381,"PA","Lancaster County","MILLERSVILLE UNIVERSITY FOUNDATION",59.715381
"8489",27789.859,"PA","Lancaster County","GRAND CHAPTER OF PA ENDOWMENT CORPORATION INC",27.789859
"8490",19730.904,"PA","Lancaster County","MENNONITE ECONOMIC DEVELOPMENT ASSOCIATES",19.730904
"8491",17434.265,"PA","Lancaster County","BOYS & GIRLS CLUB OF LANCASTER",17.434265
"8492",16897.91,"PA","Lancaster County","LITITZ COMMUNITY CENTER",16.89791
"8493",15760.318,"PA","Lancaster County","LINDEN HALL SCHOOL FOR GIRLS",15.760318
"8494",14955.854,"PA","Lancaster County","TEN THOUSAND VILLAGES",14.955854
"8495",12288.513,"PA","Lancaster County","BOYS CLUB OF LANCASTER FOUNDATION",12.288513
"8496",9145.195,"PA","Lancaster County","ELIZABETH S LUDGATE TEST TRUST",9.145195
"8497",3403.389,"PA","Lawrence County","ARISE LAWRENCE COUNTY",3.403389
"8498",2534.045,"PA","Lawrence County","NEW WILMINGTON MISSIONARY CONFERENCE ENDOWMENT FOUNDATION",2.534045
"8499",1249.745,"PA","Lawrence County","HIGHLAND TERRACE HOUSING CORP",1.249745
"8500",1214.204,"PA","Lawrence County","PEOPLE IN NEED",1.214204
"8501",1089.71,"PA","Lawrence County","SHENANGO TREETOPS INC",1.08971
"8502",896.653,"PA","Lawrence County","CEDARCREST HOUSING CORPORATION",0.896653
"8503",714.509,"PA","Lawrence County","NEW CASTLE CHRISTIAN ACADEMY INC",0.714509
"8504",699.527,"PA","Lawrence County","WAMPUM PARK HOUSING CORP",0.699527
"8505",644.881,"PA","Lawrence County","HABITAT FOR HUMANITY INTERNATIONAL INC",0.644881
"8506",421.109,"PA","Lawrence County","PATCHES PLACE",0.421109
"8507",6705.296,"PA","Lebanon County","LEBANON VALLEY ECONOMIC DEVELOPMENT CORPORATION",6.705296
"8508",4791.096,"PA","Lebanon County","NEW COVENANT CHRISTIAN SCHOOL FOUNDATION",4.791096
"8509",4756.023,"PA","Lebanon County","UNITED WAY OF LEBANON COUNTY INC",4.756023
"8510",1894.052,"PA","Lebanon County","COMMUNITY HOMES OF LEBANON COUNTY INC",1.894052
"8511",1821.364,"PA","Lebanon County","SEXUAL ASSAULT RESOURCE & COUNSELING CENTER OF LEBANON & SCH",1.821364
"8512",1279.449,"PA","Lebanon County","QUALITY EMPLOYMENT SERVICES AND TRAINING INC",1.279449
"8513",1246.692,"PA","Lebanon County","DEVELOPMENTAL AND DISABILITY SERVICES OF LEBANON VALLEY",1.246692
"8514",1184.745,"PA","Lebanon County","SCHAEFFERSTOWN MENNONITE HIGH SCHOOL INC",1.184745
"8515",896.704,"PA","Lebanon County","FALCON FOUNDATION",0.896704
"8516",839.313,"PA","Lebanon County","DOMESTIC VIOLENCE INTERVENTION OF LEBANON COUNTY INC",0.839313
"8517",43625.583,"PA","Lehigh County","CAI LEARNING ACADEMY INC",43.625583
"8518",30512.216,"PA","Lehigh County","CATHOLIC FOUNDATION OF ALLENTOWN INC",30.512216
"8519",28408.57,"PA","Lehigh County","LEHIGH CARBON COMMUNITY COLLEGE FOUNDATION",28.40857
"8520",26696.513,"PA","Lehigh County","ALLENTOWN ART MUSEUM",26.696513
"8521",15668.417,"PA","Lehigh County","THE ARC OF LEHIGH AND NORTHAMPTON COUNTIES INC",15.668417
"8522",10869.883,"PA","Lehigh County","HABITAT FOR HUMANITY INTERNATIONAL INC",10.869883
"8523",9244.479,"PA","Lehigh County","POCONO HEALTH FOUNDATION",9.244479
"8524",7619.235,"PA","Lehigh County","ALLENTOWN BNAI BRITH HOUSING CORP",7.619235
"8525",6672.108,"PA","Lehigh County","HILLSIDE SCHOOL",6.672108
"8526",6406.035,"PA","Lehigh County","COMMUNITIES IN SCHOOLS OF EASTERN PENNSYLVANIA INC",6.406035
"8527",10460.741,"PA","Luzerne County","NORTH BRANCH LAND TRUST",10.460741
"8528",6133.523,"PA","Luzerne County","NORTH PENN LEGAL SERVICES INC",6.133523
"8529",5213.957,"PA","Luzerne County","DOMESTIC VIOLENCE SERVICE CENTER INC",5.213957
"8530",2392.695,"PA","Luzerne County","I B E W LOCAL 163 JOINT APPRENTICE & TRAINING COMMITTE",2.392695
"8531",2297.259,"PA","Luzerne County","VOLUNTEERS OF AMERICA INC",2.297259
"8532",1980.75,"PA","Luzerne County","WYOMING VALLEY MONTESSORI ASSOCIATION INC",1.98075
"8533",1466.028,"PA","Luzerne County","WYOMING VALLEY ALCOHOL & DRUG SERVICES INC",1.466028
"8534",1272.293,"PA","Luzerne County","PATHWAY TO RECOVERY COUNSELING AND EDUCATIONAL SERVICES",1.272293
"8535",1220.553,"PA","Luzerne County","MCGLYNN CENTER",1.220553
"8536",859.726,"PA","Luzerne County","NEPA INCLUSIVE",0.859726
"8537",4314.914,"PA","Lycoming County","YOUNG WOMENS CHRISTIAN ASSOCIATION OF NORTHCENTRAL PENNSYLVANIA",4.314914
"8538",3395.138,"PA","Lycoming County","AIDS RESOURCE ALLIANCE INC",3.395138
"8539",2568.28,"PA","Lycoming County","LYCOMING COUNTY HISTORICAL SOCIETY",2.56828
"8540",2327.294,"PA","Lycoming County","WILLIAMSPORT AREA SCHOOL DISTRICT EDUCATION FOUNDATION",2.327294
"8541",1492.494,"PA","Lycoming County","TRANSITIONAL LIVING CENTERS INC",1.492494
"8542",1423.823,"PA","Lycoming County","WILLIAMSPORT SYMPHONY ORCHESTRA",1.423823
"8543",519.794,"PA","Lycoming County","UPTOWN MUSIC COLLECTIVE",0.519794
"8544",105.143,"PA","Lycoming County","LYCOMING COUNTY CHILDRENS DEVELOPMENT CENTER",0.105143
"8545",65.045,"PA","Lycoming County","ECKELS ADOPTION AGENCY INC",0.065045
"8546",4767.055,"PA","McKean County","CARE FOR CHILDREN",4.767055
"8547",1110.563,"PA","McKean County","UNITED WAY OF THE BRADFORD AREA INC",1.110563
"8548",467.41,"PA","McKean County","MT JEWETT AREA AMBULANCE ASSOCIATION INC",0.46741
"8549",462.678,"PA","McKean County","BRADFORD AREA ALLIANCE",0.462678
"8550",231.788,"PA","McKean County","BRADFORD LEARNING CENTER",0.231788
"8551",139.259,"PA","McKean County","BRADFORD AREA CHRISTIAN ACADEMY INC",0.139259
"8552",116.932,"PA","McKean County","PORT AREA AMBULANCE SERVICE INC",0.116932
"8553",405995.282,"PA","Mercer County","GROVE CITY COLLEGE",405.995282
"8554",100554.582,"PA","Mercer County","GEORGE JUNIOR REPUBLIC",100.554582
"8555",36572.097,"PA","Mercer County","GEORGE JUNIOR REPUBLIC REALTY",36.572097
"8556",30299.197,"PA","Mercer County","GROVE CITY HEALTH SYSTEM FOUNDATION",30.299197
"8557",9513.163,"PA","Mercer County","COMMUNITY COUNSELING CENTER OF MERCER COUNTY",9.513163
"8558",7558.385,"PA","Mercer County","WHOLE LIFE SERVICES INC",7.558385
"8559",4989.417,"PA","Mercer County","GEORGE JUNIOR REPUBLIC IN PENNSYLVANIA",4.989417
"8560",4299.412,"PA","Mercer County","WESTFIELD TOWERS INC",4.299412
"8561",3385.584,"PA","Mercer County","GEORGE JUNIOR REPUBLIC IN INDIANA INC",3.385584
"8562",3053.127,"PA","Mercer County","NORTH EAST MANOR INC",3.053127
"8563",868.679,"PA","Mifflin County","JUNIATA VALLEY TRI-COUNTY DRUG & ALCOHOL ABUSE COMMISSION",0.868679
"8564",778.196,"PA","Mifflin County","MIFFLIN COUNTY HISTORICAL SOCIETY",0.778196
"8565",730.641,"PA","Mifflin County","HABITAT FOR HUMANITY INTERNATIONAL INC",0.730641
"8566",717.288,"PA","Mifflin County","UNITED WAY OF MIFFLIN JUNIATA",0.717288
"8567",590.912,"PA","Mifflin County","ABUSE NETWORK INC",0.590912
"8568",565.79,"PA","Mifflin County","BIG VALLEY AMBULANCE CLUB INC",0.56579
"8569",443.102,"PA","Mifflin County","SHELTER SERVICES INC",0.443102
"8570",58993.268,"PA","Monroe County","UNIVERSITY PROPERTIES INC",58.993268
"8571",3040.015,"PA","Monroe County","WOMENS RESOURCES OF MONROE COUNTY INC",3.040015
"8572",1670.46,"PA","Monroe County","POCONO HERITAGE LAND TRUST INC",1.67046
"8573",757.256,"PA","Monroe County","UNITED STATES BOWLING CONGRESS INC",0.757256
"8574",663.958,"PA","Monroe County","EVERGREEN COMMUNITY SCHOOL FOUNDATION",0.663958
"8575",620.048,"PA","Monroe County","KEYSTONE ATHLETIC",0.620048
"8576",343.076,"PA","Monroe County","MENTAL HEALTH NEWS EDUCATION INC",0.343076
"8577",276.585,"PA","Monroe County","THE GROWING CONCERN INC",0.276585
"8578",101362.36,"PA","Montgomery County","SHIPLEY SCHOOL",101.36236
"8579",80554.802,"PA","Montgomery County","BALDWIN SCHOOL",80.554802
"8580",47470.345,"PA","Montgomery County","THE ASSOCIATION FOR FRONTOTEMPORAL DEGENERATION",47.470345
"8581",21032.14,"PA","Montgomery County","MONTGOMERY COUNTY COMMUNITY COLLEGE FOUNDATION",21.03214
"8582",17291.349,"PA","Montgomery County","FRANK C AND MATTIE H THOMPSON MEMORIAL TRUST",17.291349
"8583",12868.209,"PA","Montgomery County","WYNDCROFT SCHOOL",12.868209
"8584",12683.154,"PA","Montgomery County","UNIVEST FOUNDATION",12.683154
"8585",12554.967,"PA","Montgomery County","SCHWENKENFELDER LIBRARY AND HERITAGE CENTER",12.554967
"8586",9810.179,"PA","Montgomery County","ROLAND J WOTRING SCHOLARSHIP FUND",9.810179
"8587",7037.101,"PA","Montgomery County","BUILDING 21",7.037101
"8588",187.632,"PA","Montour County","MONTOUR DELONG FAIR ASSOCIATION",0.187632
"8589",98710.827,"PA","Northampton County","NORTHAMPTON COUNTY AREA COMMUNITY COLLEGE FOUNDATION",98.710827
"8590",10415.176,"PA","Northampton County","THE PATRIOT LEAGUE",10.415176
"8591",9906.05,"PA","Northampton County","BACH CHOIR OF BETHLEHEM",9.90605
"8592",7859.937,"PA","Northampton County","STATE THEATRE CENTER FOR THE ARTS INC",7.859937
"8593",4853.695,"PA","Northampton County","NORTHEAST PENNSYLVANIA LIONS SERVICE FOUNDATION INC",4.853695
"8594",3543.336,"PA","Northampton County","EASTON AREA PUBLIC LIBRARY",3.543336
"8595",3292.14,"PA","Northampton County","THE MORAVIAN HISTORICAL SOCIETY",3.29214
"8596",2877.503,"PA","Northampton County","YOUNG WOMENS CHRISTIAN ASSOCIATION OF BETHLEHEM PA",2.877503
"8597",2060.194,"PA","Northampton County","LIFEPATH FOUNDATION",2.060194
"8598",1809.901,"PA","Northampton County","EPISCOPAL APARTMENTS OF THE SLATE BELT INC",1.809901
"8599",581.134,"PA","Northumberland County","CONCERNED CITIZENS CHILD-CARE INC",0.581134
"8600",155.573,"PA","Northumberland County","ROBINWOOD DAY CARE CENTER INC",0.155573
"8601",681.968,"PA","Perry County","PERRY HUMAN SERVICES INC",0.681968
"8602",288.943,"PA","Perry County","HERITAGE CHRISTIAN SCHOOL OF WEST PERRY",0.288943
"8603",77.949,"PA","Perry County","WEST PERRY ATHLETIC BOOSTER CLUB",0.077949
"8604",121851.629,"PA","Philadelphia County","ZOOLOGICAL SOCIETY OF PHILADELPHIA",121.851629
"8605",121191.233,"PA","Philadelphia County","ANNENBERG SCHOOL FOR COMMUNICATION TR AT THE UNIVERSITY OF PA",121.191233
"8606",53200.331,"PA","Philadelphia County","MANN CENTER FOR THE PERFORMING ARTS",53.200331
"8607",46475.598,"PA","Philadelphia County","ACADEMY OF VOCAL ARTS",46.475598
"8608",44939.432,"PA","Philadelphia County","THE CATHOLIC FOUNDATION OF GREATER PHILADELPHIA",44.939432
"8609",30100.596,"PA","Philadelphia County","PHILADELPHIA SCHOOL",30.100596
"8610",29186.096,"PA","Philadelphia County","COMMUNITY LEGAL SERVICES INC",29.186096
"8611",23016.637,"PA","Philadelphia County","8001 TORRESDALE CORPORATION",23.016637
"8612",20733.4,"PA","Philadelphia County","COMMUNITY COLLEGE OF PHILADELPHIA FOUNDATION",20.7334
"8613",15842.401,"PA","Philadelphia County","SAINT JAMES SCHOOL",15.842401
"8614",502.724,"PA","Pike County","MILFORD COMMUNITY HOUSE INC",0.502724
"8615",50.676,"PA","Pike County","VIRTUEONLINE",0.050676
"8616",622.743,"PA","Potter County","POTTER COUNTY EDUCATIONAL COUNCIL INC",0.622743
"8617",418.647,"PA","Potter County","PENN-YORK CAMP ASSOCIATION INC",0.418647
"8618",3264.56,"PA","Schuylkill County","SCHUYLKILL WOMEN IN CRISIS",3.26456
"8619",1798.549,"PA","Schuylkill County","POTTSVILLE AREA EMERGENCY MEDICAL SERVICES INC",1.798549
"8620",799.487,"PA","Schuylkill County","PENNSYLVANIA LIONS SIGHT CONSERVATION AND EYE RESEARCH FOUN",0.799487
"8621",716.548,"PA","Schuylkill County","MARGARET M LICHTY CHARITABLE TRUST 1519159178",0.716548
"8622",603.228,"PA","Schuylkill County","PINE GROVE AREA EDUCATION FOUNDATION",0.603228
"8623",566.735,"PA","Schuylkill County","NATIVITY PRESERVATION SUPPORT FOUNDATION",0.566735
"8624",216.644,"PA","Schuylkill County","TAMAQUA AREA ADULT DAY CARE CENTER",0.216644
"8625",106.627,"PA","Schuylkill County","HOUSING DEVELOPMENT CORPORATION OF SCHUYLKILL COUNTY",0.106627
"8626",34.564,"PA","Schuylkill County","ADVISORY BOARD OF THE SCHUYLKILL CAMPUS OF THE PENN STATE UNIV",0.034564
"8627",5.979,"PA","Schuylkill County","PINE GROVE BAND BOOSTERS",0.005979
"8628",19.736,"PA","Snyder County","CHILDRENS DISCOVERY CENTERS INC",0.019736
"8629",18901.781,"PA","Somerset County","CHILDRENS AID HOME AND SOCIETY OF SOMERSET COUNTY",18.901781
"8630",1710.011,"PA","Somerset County","CHILDRENS AID HOME PROGRAMS OF SOMERSET COUNTY INC",1.710011
"8631",1129.031,"PA","Somerset County","MEALS ON WHEELS OF SOMERSET COUNTY INC",1.129031
"8632",1097.667,"PA","Somerset County","PA ELKS MAJOR PROJECTS INC",1.097667
"8633",519.214,"PA","Somerset County","NEW BALTIMORE AND AREA VOLUNTEER FIRE COMPANY",0.519214
"8634",396.172,"PA","Sullivan County","SULLIVAN COUNTY VICTIM SERVICES",0.396172
"8635",3335.872,"PA","Susquehanna County","THE UNITED FIRE COMPANY OF MONTROSE PENNA",3.335872
"8636",1579.286,"PA","Susquehanna County","SUSQUEHANNA COUNTY INTERFAITH",1.579286
"8637",1139.6,"PA","Susquehanna County","EDWARD L ROSE CONSERVANCY INC",1.1396
"8638",26424.701,"PA","Tioga County","LAUREL HEALTH FOUNDATION",26.424701
"8639",2566.2,"PA","Tioga County","MANSFIELD AUXILIARY CORPORATION",2.5662
"8640",2566.2,"PA","Tioga County","MANSFIELD AUXILIARY CORPORATION",2.5662
"8641",2257.22,"PA","Tioga County","MANSFIELD FIREMENS AMBULANCE ASSOCIATION INC",2.25722
"8642",2013.008,"PA","Tioga County","BRADFORD-TIOGA HEAD START INC",2.013008
"8643",756.092,"PA","Tioga County","HARBOR COUNSELING INC",0.756092
"8644",705.109,"PA","Tioga County","WELLSPRING COMMUNITY SUPPORT SERVICES",0.705109
"8645",474.993,"PA","Tioga County","CRARY HOSE COMPANY",0.474993
"8646",325.404,"PA","Tioga County","WESTFIELD CHILD DEVELOPMENT CENTER",0.325404
"8647",272.842,"PA","Tioga County","NORTHCENTRAL PENNSYLVANIA AHEC INC",0.272842
"8648",711959.439,"PA","Union County","ANABAPTIST FINANCIAL",711.959439
"8649",52516.777,"PA","Union County","ANABAPTIST FOUNDATION",52.516777
"8650",1587.734,"PA","Union County","GREEN DRAGON FOUNDATION",1.587734
"8651",899.865,"PA","Union County","OPEN HANDS",0.899865
"8652",605.433,"PA","Union County","STEWARDSHIP RESOURCES",0.605433
"8653",350.462,"PA","Union County","LEWISBURG AREA CHILD CARE CENTER",0.350462
"8654",440.782,"PA","Venango County","ROCKY GROVE VOLUNTEER FIREMENS RELIEF ASSOCIATION",0.440782
"8655",10655.096,"PA","Warren County","WARREN AND FOREST COUNTIES ECONOMIC OPPORTUNITY COUNCIL",10.655096
"8656",4415.895,"PA","Warren County","HIY INC",4.415895
"8657",109.929,"PA","Warren County","A SAFE PLACE",0.109929
"8658",46101.564,"PA","Washington County","FOUNDATION FOR CALIFORNIA UNIVERSITY OF PENNSYLVANIA",46.101564
"8659",26120.316,"PA","Washington County","ARC HUMAN SERVICE INC",26.120316
"8660",22135.083,"PA","Washington County","STUDENT ASSOCIATION INC",22.135083
"8661",2702.688,"PA","Washington County","PONY BASEBALL INC",2.702688
"8662",2371.492,"PA","Washington County","DOMESTIC VIOLENCE SERVICES OF SOUTHWESTERN PENNSYLVANIA",2.371492
"8663",1703.463,"PA","Washington County","SOUTHWESTERN PENNSYLVANIA LEGAL AID",1.703463
"8664",1086.737,"PA","Washington County","MID AMERICAN DISTRICT HOCKEY INC",1.086737
"8665",861.045,"PA","Washington County","PATHWAYS OF SOUTHWESTERN PENNSYLVANIA INC",0.861045
"8666",751.945,"PA","Washington County","CENTER IN THE WOODS INC",0.751945
"8667",539.892,"PA","Washington County","AADVANTAGE INC",0.539892
"8668",6250.809,"PA","Wayne County","HIGHLIGHTS FOUNDATION INC",6.250809
"8669",5987.856,"PA","Wayne County","HUMAN RESOURCES CENTER FOUNDATION",5.987856
"8670",570.099,"PA","Wayne County","MINOR LIBRARY FUND UNDER THE WILL OF KATHERINE B MINOR",0.570099
"8671",474.362,"PA","Wayne County","PROTECTION ENGINE COMPANY NO 3",0.474362
"8672",359.744,"PA","Wayne County","WORKFORCE WAYNE",0.359744
"8673",28519.171,"PA","Westmoreland County","ADELPHOI FOUNDATION",28.519171
"8674",25924.311,"PA","Westmoreland County","ADELPHOI VILLAGE INC",25.924311
"8675",24135.127,"PA","Westmoreland County","ADELPHOI USA INC",24.135127
"8676",14961.365,"PA","Westmoreland County","DR ROBERT KETTERER CHARTER SCHOOL INC",14.961365
"8677",10342.319,"PA","Westmoreland County","HOMES BUILD HOPE INC",10.342319
"8678",8550.044,"PA","Westmoreland County","CITIZENS GENERAL HEALTH FOUNDATION",8.550044
"8679",7577.126,"PA","Westmoreland County","ADELPHOI EDUCATION INC",7.577126
"8680",4276.552,"PA","Westmoreland County","ROYAL ORDER OF SCOTLAND PROVINCIAL",4.276552
"8681",4242.3,"PA","Westmoreland County","LOYALHANNA WATERSHED ASSOCIATION INC",4.2423
"8682",2166.877,"PA","Westmoreland County","LAUREL LEGAL SERVICES INC",2.166877
"8683",423.925,"PA","Wyoming County","H A N D S OF WYOMING COUNTY",0.423925
"8684",372.301,"PA","Wyoming County","NORTHERN TIER INDUSTRY EDUCATION CONSORTIUM INC",0.372301
"8685",94.493,"PA","Wyoming County","INTERFAITH FRIENDS",0.094493
"8686",13485.191,"PA","York County","STRAND-CAPITOL PERFORMING ARTS CENTER INC",13.485191
"8687",10505.199,"PA","York County","SUSAN P BYRNES HEALTH EDUCATION CENTER INC",10.505199
"8688",3840.853,"PA","York County","HANOVER PUBLIC LIBRARY ASSOCIATION INC",3.840853
"8689",3839.298,"PA","York County","COLONIAL HOUSE INC",3.839298
"8690",2896.684,"PA","York County","MANTEC INC",2.896684
"8691",2634.219,"PA","York County","FARM & NATURAL LAND TRUST OF YORK COUNTY",2.634219
"8692",2449.478,"PA","York County","RED LION AREA EDUCATIONAL FOUNDATION",2.449478
"8693",1470.048,"PA","York County","YORK COUNTY LITERACY COUNCIL",1.470048
"8694",1431.127,"PA","York County","HERITAGE SENIOR CENTER INC",1.431127
"8695",1294.113,"PA","York County","SOUTHERN YORK COUNTY SCHOOL DISTRICT FOUNDATION",1.294113
