"5590",2159.778,"NC","Alamance County","RESIDENTIAL TREATMENT SERVICES OF ALAMANCE INC",2.159778
"5591",1276.417,"NC","Alamance County","ALAMANCE COUNTY ARTS COUNCIL INC",1.276417
"5592",1155.44,"NC","Alamance County","ALAMANCE COUNTY HISTORICAL MUSEUM INC",1.15544
"5593",932.844,"NC","Alamance County","CHILDRENS ADVOCACY CENTERS OF NORTH CAROLINA INC",0.932844
"5594",702.459,"NC","Alamance County","ALAMANCE ELDER CARE INC",0.702459
"5595",437.779,"NC","Alamance County","IBMA FOUNDATION INC",0.437779
"5596",339.596,"NC","Alamance County","NEW LEAF SOCIETY",0.339596
"5597",185.1,"NC","Alamance County","CULTURE MILL INC",0.1851
"5598",2465.714,"NC","Alexander County","BETHLEHEM COMMUNITY FIRE & RESCUE INC",2.465714
"5599",2444.02,"NC","Alexander County","ALEXANDER COUNTY ECONOMICDEVELOPMENT CORPORATION",2.44402
"5600",1908.448,"NC","Alexander County","HOSPICE AND HOME CARE OF ALEXANDER COUNTY INC",1.908448
"5601",1513.109,"NC","Alexander County","STONY POINT VOLUNTEER FIRE DEPT",1.513109
"5602",931.292,"NC","Alexander County","ELLENDALE VOLUNTEER FIRE DEPARTMENT",0.931292
"5603",688.352,"NC","Alexander County","ALEXANDER RESCUE SQUAD & EMS INC",0.688352
"5604",349.867,"NC","Alexander County","HIDDENITE CENTER INC",0.349867
"5605",139.892,"NC","Alexander County","ALEXANDER COUNTY PARTNERSHIP FOR CHILDREN",0.139892
"5606",1764.981,"NC","Alleghany County","PINEY CREEK VOLUNTEER FIRE DEPARTMENT INCORPORATED",1.764981
"5607",1559.529,"NC","Alleghany County","ALLEGHANY COUNTY GROUP HOMES INC",1.559529
"5608",862.515,"NC","Alleghany County","ALLEGHANY CARES INC",0.862515
"5609",653.213,"NC","Alleghany County","ALLEGHANY JAM",0.653213
"5610",384.683,"NC","Alleghany County","NEW RIVER COTTAGE INC",0.384683
"5611",250.342,"NC","Alleghany County","ALLEGHANY COUNTY COUNCIL ON AGING INC",0.250342
"5612",996.605,"NC","Ashe County","ASHE COUNTY JOB DEVELOPMENT INC",0.996605
"5613",761.248,"NC","Ashe County","WARRENVILLE VOLUNTEER FIRE & RESCUE DEPARTMENT INC",0.761248
"5614",834.941,"NC","Avery County","LINVILLE-CENTRAL RESCUE SQUAD INC",0.834941
"5615",780.193,"NC","Avery County","MARJORIE WILLIAMS ACADEMY",0.780193
"5616",481.934,"NC","Avery County","LINVILLE VOLUNTEER FIRE DEPARTMENT CAPITAL FUND INC",0.481934
"5617",20.885,"NC","Avery County","SWEETWATER SPRINGS BIBLICAL COUNSELING CENTER INC",0.020885
"5618",8070.154,"NC","Beaufort County","WASHINGTON MONTESSORI INC-A PUBLIC CHARTER SCHOOL",8.070154
"5619",1527.856,"NC","Beaufort County","BEAUFORT COUNTY ARTS COUNCIL",1.527856
"5620",847.692,"NC","Beaufort County","PUNGO CHRISTIAN ACADEMY INC",0.847692
"5621",801.805,"NC","Beaufort County","EAGLES WINGS CHRISTIAN LOVE IN ACTION",0.801805
"5622",791.185,"NC","Beaufort County","BATH VOLUNTEER FIRE DEPARTMENT INC",0.791185
"5623",745.417,"NC","Beaufort County","AURORA FOSSIL MUSEUM FOUNDATION INC",0.745417
"5624",579.683,"NC","Beaufort County","WILKINSON COMMUNITY EVENT CENTER",0.579683
"5625",348.744,"NC","Beaufort County","BEAUFORT COUNTY UNITED WAY INC",0.348744
"5626",316.102,"NC","Beaufort County","UNITY CHRISTIAN ACADEMY OF HAW BRANCH INC",0.316102
"5627",284.421,"NC","Beaufort County","OPEN DOOR COMMUNITY CENTER",0.284421
"5628",4592.381,"NC","Bertie County","BERTIE COUNTY RURAL HEALTH ASSOCIATION",4.592381
"5629",150.994,"NC","Bertie County","BERTIE COUNTY Y M C A INC",0.150994
"5630",1231.557,"NC","Bladen County","BLADEN COMMUNITY COLLEGE FOUNDATION INC",1.231557
"5631",203.255,"NC","Bladen County","BLADEN SMART START-A PARTNERSHIP FOR CHILDREN INC",0.203255
"5632",8567.678,"NC","Brunswick County","BRUNSWICK COLUMBUS INTERNATIONAL PARK INC",8.567678
"5633",6950.547,"NC","Brunswick County","HABITAT FOR HUMANITY INTERNATIONAL INC",6.950547
"5634",6658.364,"NC","Brunswick County","BRUNSWICK COMMUNITY COLLEGE FOUNDATION INC",6.658364
"5635",5736.413,"NC","Brunswick County","ST JAMES FIRE DEPARTMENT INC",5.736413
"5636",1675.912,"NC","Brunswick County","HOPE HARBOR HOME INC",1.675912
"5637",1201.838,"NC","Brunswick County","NW VOLUNTEER FIRE-RESCUE DEPT INC",1.201838
"5638",1144.465,"NC","Brunswick County","COMMUNITIES IN SCHOOLS OF BRUNSWICK COUNTY",1.144465
"5639",912.266,"NC","Brunswick County","SUNSET HARBOR AND ZION HILL VOLUNTEER FIRE DEPARTMENT INC",0.912266
"5640",823.68,"NC","Brunswick County","BRUNSWICK PARTNERSHIP FOR HOUSING",0.82368
"5641",530.264,"NC","Brunswick County","WACCAMAW VOLUNTEER FIRE DEPARTMENT AND RESCUE SQUAD INC",0.530264
"5642",45623.697,"NC","Buncombe County","CHRIST SCHOOL INC",45.623697
"5643",24633.05,"NC","Buncombe County","APPALACHIAN MOUNTAIN COMMUNITY HE",24.63305
"5644",17105.214,"NC","Buncombe County","ASTON PARK HEALTH CARE CENTER INC",17.105214
"5645",10399.911,"NC","Buncombe County","LEICESTER VOLUNTEER FIRE DEPARTMENT INC",10.399911
"5646",8633.478,"NC","Buncombe County","WEST BUNCOMBE VOLUNTEER FIRE DEPARTMENT INCORPORATED",8.633478
"5647",7175.786,"NC","Buncombe County","FOUNDATION FOR THE ARTS AT THE CORE OF EDUCATION",7.175786
"5648",5821.898,"NC","Buncombe County","SOUTHEAST REGIONAL LAND CONSERVANCY INC",5.821898
"5649",5750.033,"NC","Buncombe County","FRENCH BROAD RIVER ACADEMY INC",5.750033
"5650",4082.325,"NC","Buncombe County","IRENE WORTHAM RESIDENTIAL CENTER INC",4.082325
"5651",4076.111,"NC","Buncombe County","IRENE WORTHAM CENTER INC",4.076111
"5652",3992.674,"NC","Burke County","WESTERN PIEDMONT FOUNDATION INC",3.992674
"5653",2632.649,"NC","Burke County","BURKE PARTNERSHIP FOR ECONOMIC DEVELOPMENT INC",2.632649
"5654",2312.017,"NC","Burke County","ICARD TOWNSHIP FIRE RESCUE INC",2.312017
"5655",1648.868,"NC","Burke County","MORGANTON DAY SCHOOL INC",1.648868
"5656",1550.77,"NC","Burke County","SABRE SOCIETY OF NORTH CAROLINA",1.55077
"5657",1423.306,"NC","Burke County","LONGTOWN VOLUNTEER FIRE DEPARTMENT INC",1.423306
"5658",1369.393,"NC","Burke County","ASSURE THE FUTURE",1.369393
"5659",1280.584,"NC","Burke County","BRENDLETOWN FIRE PROTECTION ASSOCIATION INC",1.280584
"5660",877.679,"NC","Burke County","LIBRARY FOUNDATION OF BURKE COUNTY INC",0.877679
"5661",595.342,"NC","Burke County","FOOTHILLS SERVICE PROJECT",0.595342
"5662",7563.471,"NC","Cabarrus County","BARBER-SCOTIA COLLEGE INC",7.563471
"5663",5123.057,"NC","Cabarrus County","CHURCH OF GOD CHILDRENS HOME OF NORTH CAROLINA INC",5.123057
"5664",5002.329,"NC","Cabarrus County","HOPE ACADEMY OF CHARLOTTE",5.002329
"5665",4818.009,"NC","Cabarrus County","HABITAT FOR HUMANITY INTERNATIONAL INC",4.818009
"5666",3074.449,"NC","Cabarrus County","CABARRUS MEALS ON WHEELS INC",3.074449
"5667",2199.618,"NC","Cabarrus County","PIEDMONT RESIDENTIAL DEVELOPMENT CENTER INC",2.199618
"5668",1619.465,"NC","Cabarrus County","FLOWES STORE VOLUNTEER FIRE DEPARTMENT INC",1.619465
"5669",1400.891,"NC","Cabarrus County","RIMER VOLUNTEER FIRE DEPARTMENT",1.400891
"5670",1198.9,"NC","Cabarrus County","COLD WATER VOLUNTEER FIRE DEPARTMENT INC",1.1989
"5671",1117.487,"NC","Cabarrus County","CABARRUS SPAY & NEUTER CLINIC INC",1.117487
"5672",21070.013,"NC","Caldwell County","FOUNDATION OF THE CALDWELL COMMUNITY COLLEGE AND TECHNICAL",21.070013
"5673",15954.018,"NC","Caldwell County","CALDWELL MEMORIAL HOSPITAL FOUNDATION INC",15.954018
"5674",9780.834,"NC","Caldwell County","COMSERV INC",9.780834
"5675",4861.649,"NC","Caldwell County","COLLETTSVILLE VOLUNTEER FIRE DEPT INC",4.861649
"5676",2311.148,"NC","Caldwell County","SAWMILLS VOLUNTEER FIRE DEPARTMENT INC",2.311148
"5677",1974.716,"NC","Caldwell County","PATTERSON VOLUNTEER FIRE DEPARTMENTINC",1.974716
"5678",1446.688,"NC","Caldwell County","NORTH CATAWBA FIRE-RESCUE DEPARTMENT INC",1.446688
"5679",1259.088,"NC","Caldwell County","CALDWELL OPPORTUNITIES INC",1.259088
"5680",555.819,"NC","Caldwell County","COMMUNITIES IN SCHOOLS OF CALDWELL COUNTY INC",0.555819
"5681",493.091,"NC","Caldwell County","HERITAGE CHRISTIAN SCHOOL",0.493091
"5682",1742.384,"NC","Carteret County","CARTERET COUNTY DOMESTIC VIOLENCE PROGRAM INC",1.742384
"5683",1700.209,"NC","Carteret County","BEAUFORT EMS INC",1.700209
"5684",1185.351,"NC","Carteret County","THE GRAMERCY SCHOOL",1.185351
"5685",718.415,"NC","Carteret County","NORTH CAROLINA STATE ELKS ASSOCIATION",0.718415
"5686",591.105,"NC","Carteret County","HARKERS ISLAND FIRE & RESCUE DEPARTMENT INC",0.591105
"5687",585.596,"NC","Carteret County","MARSHALLBERG VOLUNTARY FIRE DEPARTMENT INC",0.585596
"5688",120.307,"NC","Carteret County","CARTERET COUNTY ECONOMICDEVELOPMENT FOUNDATION INC",0.120307
"5689",53.142,"NC","Carteret County","EAST CARTERET BAND BOOSTERS INC",0.053142
"5690",6527.928,"NC","Caswell County","COMPASSION HEALTH CARE INC",6.527928
"5691",901.291,"NC","Caswell County","CASVILLE VOLUNTEER FIRE DEPARTMENT INC",0.901291
"5692",445.355,"NC","Caswell County","RAINBOW EDUCATIONAL CHILD CARE CENTER",0.445355
"5693",104.779,"NC","Caswell County","AGUA VIVA MINISTRIES",0.104779
"5694",23.066,"NC","Caswell County","CASWELL COUNTY PARTNERSHIP FOR CHILDREN",0.023066
"5695",12907.402,"NC","Catawba County","SALT BLOCK FOUNDATION INC",12.907402
"5696",9546.164,"NC","Catawba County","CATAWBA VALLEY COMMUNITY COLLEGE FOUNDATION INC",9.546164
"5697",8635.144,"NC","Catawba County","THE MENTAL HEALTH FUND INC",8.635144
"5698",8339.769,"NC","Catawba County","CATAWBA SCIENCE CENTER INC",8.339769
"5699",7777.637,"NC","Catawba County","SIPES ORCHARD HOME",7.777637
"5700",6260.359,"NC","Catawba County","ST STEPHENS FIRE DEPT",6.260359
"5701",5806.246,"NC","Catawba County","HABITAT FOR HUMANITY OF CATAWBA VALLEY INC",5.806246
"5702",4769.497,"NC","Catawba County","HICKORY MUSEUM OF ART INC",4.769497
"5703",4351.211,"NC","Catawba County","THE GREEN ROOM COMMUNITY THEATRE INC",4.351211
"5704",3658.245,"NC","Catawba County","CATAWBA MEDICAL FOUNDATION INC",3.658245
"5705",5992.472,"NC","Chatham County","HABITAT FOR HUMANITY INTERNATIONAL INC",5.992472
"5706",5496.461,"NC","Chatham County","PITTSBORO VOLUNTEER FIRE AND RESCUE DEPARTMENT INC",5.496461
"5707",4485.358,"NC","Chatham County","CHATHAM COUNTY COUNCIL ON AGING INC",4.485358
"5708",3275.205,"NC","Chatham County","CHATHAM OUTREACH ALLIANCE INC",3.275205
"5709",1117.344,"NC","Chatham County","HIGH PINE BEACH ASSOCIATION INC",1.117344
"5710",1099.347,"NC","Chatham County","THE LIVESTOCK CONSERVANCY INC",1.099347
"5711",791.465,"NC","Chatham County","COMMUNITIES IN SCHOOLS OF CHATHAM COUNTY",0.791465
"5712",335.03,"NC","Chatham County","COUNTER TOOLS",0.33503
"5713",317.814,"NC","Chatham County","CHATHAM COUNTY LITERACY COUNCIL INC",0.317814
"5714",312.216,"NC","Chatham County","HUMMINGBIRD FARM",0.312216
"5715",6153.882,"NC","Cherokee County","INDUSTRIAL OPPORTUNITIES",6.153882
"5716",861.423,"NC","Cherokee County","VALLEY RIVER ARTS GUILD INC",0.861423
"5717",741.822,"NC","Cherokee County","VALLEY RIVER HUMANE SOCIETY INC",0.741822
"5718",197.589,"NC","Cherokee County","REACH OF CHEROKEE COUNTY INC",0.197589
"5719",178.268,"NC","Cherokee County","ASSOCIATION FOR RETARDED CITIZENS CHEROKEE-CLAY INC",0.178268
"5720",14.401,"NC","Cherokee County","CHEROKEE COUNTY UNITED FUND INC",0.014401
"5721",1562.765,"NC","Chowan County","HABITAT FOR HUMANITY INTERNATIONAL INC",1.562765
"5722",64.058,"NC","Chowan County","CHOWAN PERQUIMANS SMART START PARTNERSHIP",0.064058
"5723",585.103,"NC","Clay County","REACH OF CLAY COUNTY INC",0.585103
"5724",3703.304,"NC","Cleveland County","CLEVELAND COMMUNITY COLLEGE FOUNDATION INC",3.703304
"5725",1361.684,"NC","Cleveland County","MARION WEST INC",1.361684
"5726",1138.234,"NC","Cleveland County","TRANSPORTATION ADMINISTRATION OF CLEVELAND COUNTY INC",1.138234
"5727",1080.317,"NC","Cleveland County","WEST WARREN HOUSING INC",1.080317
"5728",219.117,"NC","Cleveland County","CHILDRENS ADVOCACY CENTER OF CLEVELAND COUNTY INC",0.219117
"5729",1252.364,"NC","Columbus County","OLD DOCK CYPRESS CREEK VOLUNTEER FIRE DEPARTMENT AND AUXILIARY",1.252364
"5730",565.071,"NC","Columbus County","NAKINA FIRE & RESCUE SQUAD INC",0.565071
"5731",495.024,"NC","Columbus County","FAIR BLUFF HOUSING INC",0.495024
"5732",405.182,"NC","Columbus County","EVERGREEN VOLUNTEER FIRE AND RESCUE DEPARTMENT",0.405182
"5733",340.61,"NC","Columbus County","COLUMBUS COUNTY PARTNERSHIP FOR CHILDREN",0.34061
"5734",268.169,"NC","Columbus County","BOLTON VOLUNTEER FIRE AND RESCUE DEPT INC",0.268169
"5735",2154.288,"NC","Craven County","CRAVEN 100 ALLIANCE",2.154288
"5736",1742.612,"NC","Craven County","THE NEW BERN HISTORICAL SOCIETY FOUNDATION INC",1.742612
"5737",1038.793,"NC","Craven County","DOVER VOLUNTEER FIRE DEPARTMENT INC",1.038793
"5738",773.471,"NC","Craven County","BISHOP MEMORIAL HOME 611 MIDDLE ST",0.773471
"5739",668.901,"NC","Craven County","NEW BERN PRESERVATION FOUNDATION INC",0.668901
"5740",549.634,"NC","Craven County","COVE CITY FIRE DEPARTMENT INC",0.549634
"5741",538.84,"NC","Craven County","TOWNSHIP SIX FIRE DEPARTMENT OF CRAVEN COUNTY NC",0.53884
"5742",320.29,"NC","Craven County","COVE CITY EMS INC",0.32029
"5743",194.609,"NC","Craven County","CRAVEN LITERACY COUNCIL",0.194609
"5744",153.609,"NC","Craven County","CRAVEN COUNTY PARTNERS IN EDUCATION INC",0.153609
"5745",121252.486,"NC","Cumberland County","CUMBERLAND COMMUNITY FOUNDATION INC",121.252486
"5746",35527.472,"NC","Cumberland County","FAYETTEVILLE AREA HEALTH EDUCATION FOUNDATION INC",35.527472
"5747",15018.795,"NC","Cumberland County","FAYETTEVILLE CHRISTIAN SCHOOL",15.018795
"5748",11103.152,"NC","Cumberland County","EMPLOYMENT SOURCE INC",11.103152
"5749",8909.455,"NC","Cumberland County","STEDMAN-WADE HEALTH SERVICES INC",8.909455
"5750",6550.744,"NC","Cumberland County","FAYETTEVILLE TECHNICAL COMMUNITY COLLEGE FOUNDATION INC",6.550744
"5751",3409.269,"NC","Cumberland County","WESTAREA VOLUNTEER FIRE DEPARTMENT INC",3.409269
"5752",2894.133,"NC","Cumberland County","CAROLINA COLLABORATIVE COMMUNITY CARE INC",2.894133
"5753",2842.946,"NC","Cumberland County","CARE CLINIC INC",2.842946
"5754",2374.866,"NC","Cumberland County","GODWIN-FALCON FIRE DEPT INC",2.374866
"5755",1224.411,"NC","Currituck County","COROLLA FIRE AND RESCUE SQUAD INC",1.224411
"5756",8686.248,"NC","Dare County","OUTER BANKS CONSERVATIONISTS INC",8.686248
"5757",7381.87,"NC","Dare County","SOUTHERN SHORES VOLUNTEER FIRE DEPARTMENT INC",7.38187
"5758",357.373,"NC","Dare County","CHILDREN & YOUTH PARTNERSHIP FOR DARE COUNTY",0.357373
"5759",3285.989,"NC","Davidson County","THE ARC DAVIDSON COUNTY INC",3.285989
"5760",2867.016,"NC","Davidson County","HASTY FIRE DEPARTMENT INC",2.867016
"5761",2598.831,"NC","Davidson County","CENTRAL FIRE DEPARTMENT OF DAVIDSON COUNTY INC",2.598831
"5762",2481.009,"NC","Davidson County","REEDS FIRE DEPARTMENT INC",2.481009
"5763",2098.469,"NC","Davidson County","ARCADIA-REEDY CREEK-HAMPTON FIRE AND RESCUE DEPARTMENT INC",2.098469
"5764",1886.367,"NC","Davidson County","SOUTH LEXINGTON VOL FIRE DEPARTMENT INC",1.886367
"5765",1825.537,"NC","Davidson County","MIDWAY FIRE & RESCUE DEPARTMENT INC",1.825537
"5766",1769.54,"NC","Davidson County","YORK RITE CHARITABLE FUND",1.76954
"5767",1741.425,"NC","Davidson County","NORTH LEXINGTON TRIANGLE FIRE DEPARTMENT INC",1.741425
"5768",1495.659,"NC","Davidson County","PILOT FIRE DEPARTMENT AND COMMUNITY CENTER OF DAVIDSON COUNTY INC",1.495659
"5769",15347.899,"NC","Davie County","NC TRIAD FUSION INC",15.347899
"5770",2407.914,"NC","Davie County","NORTHWEST CHILD DEVELOPMENT CENTERS INC",2.407914
"5771",1662,"NC","Davie County","DAVIE COUNTY PUBLIC FACILITIESFINANCING CORPORATION",1.662
"5772",1331.214,"NC","Davie County","SHEFFIELD-CALAHALN VOLUNTEER FIRE DEPARTMENT INC RESCUE INC",1.331214
"5773",1177.21,"NC","Davie County","IMPACT OF THE PIEDMONT INC",1.17721
"5774",893.22,"NC","Davie County","HABITAT FOR HUMANITY INTERNATIONAL INC",0.89322
"5775",841.51,"NC","Davie County","FARMINGTON VOLUNTEER FIRE DEPARTMENT INC",0.84151
"5776",529.431,"NC","Davie County","WILLIAM R DAVIE VOLUNTEER FIRE DEPARTMENT INC",0.529431
"5777",509.837,"NC","Davie County","CENTER VOLUNTEER FIRE DEPARTMENT",0.509837
"5778",398.624,"NC","Davie County","SMITH GROVE VOLUNTEER FIRE DEPARTMENT INC",0.398624
"5779",2061.666,"NC","Duplin County","ROSE HILL FIREMEN INC",2.061666
"5780",1280.131,"NC","Duplin County","ALBERTSON VOLUNTEER FIRE DEPARTMENT",1.280131
"5781",215.776,"NC","Duplin County","DUPLIN MEDICAL ASSOCIATION INC",0.215776
"5782",226600.958,"NC","Durham County","NEW DURHAM CORPORATION",226.600958
"5783",53982.608,"NC","Durham County","TRIANGLE RESIDENTIAL OPTIONS FOR SUBSTANCE ABUSERS INC",53.982608
"5784",25348.763,"NC","Durham County","DURHAM EXCHANGE CLUB INDUSTRIES INC",25.348763
"5785",19555.128,"NC","Durham County","EMILY KRZYZEWSKI FAMILY LIFE CENTER INC",19.555128
"5786",19123.112,"NC","Durham County","LINCOLN COMMUNITY HEALTH CENTER INCORPORATED",19.123112
"5787",16276.39,"NC","Durham County","DURHAM COMMUNITY LAND TRUSTEES INC",16.27639
"5788",14218.632,"NC","Durham County","FOREST HISTORY SOCIETY INC",14.218632
"5789",9578.523,"NC","Durham County","FAMILIES AND COMMUNITIES RISING INC",9.578523
"5790",9340.562,"NC","Durham County","CARING HOUSE INC",9.340562
"5791",5956.512,"NC","Durham County","MONTESSORI SCHOOL OF DURHAM",5.956512
"5792",5325.378,"NC","Edgecombe County","POSITIVE ACTION FOR CHRIST INC",5.325378
"5793",3349.803,"NC","Edgecombe County","EDGECOMBE COMMUNITY COLLEGE FOUNDATION INC",3.349803
"5794",990.691,"NC","Edgecombe County","SOUTH EDGECOMBE RURAL FIRE DEPARTMENT",0.990691
"5795",772.584,"NC","Edgecombe County","UNITED COMMUNITY MINISTRIES",0.772584
"5796",593.802,"NC","Edgecombe County","HABITAT FOR HUMANITY INTERNATIONAL",0.593802
"5797",527.627,"NC","Edgecombe County","EDGECOMBE COUNTY PUBLIC SCHOOLS EDUCATIONAL FOUNDATION",0.527627
"5798",30.242,"NC","Edgecombe County","CONETOE VOLUNTEER FIRE COMPANY",0.030242
"5799",14533.335,"NC","Forsyth County","FORSYTH TECHNICAL COMMUNITY COLLEGE FOUNDATION INC",14.533335
"5800",14533.335,"NC","Forsyth County","FORSYTH TECHNICAL COMMUNITY COLLEGE FOUNDATION INC",14.533335
"5801",9556.651,"NC","Forsyth County","HORIZONS RESIDENTIAL CARE CENTER INC",9.556651
"5802",7346.167,"NC","Forsyth County","SAMARITAN MINISTRIES",7.346167
"5803",6891.086,"NC","Forsyth County","MONTESSORI CHILDRENS CENTER INC",6.891086
"5804",6644.972,"NC","Forsyth County","WINSTON SALEM RESCUE MISSION",6.644972
"5805",5838.669,"NC","Forsyth County","UNIVERSITY OF NORTH CAROLINA SCHOOL OF THE ARTS HOUSING CORPORATION",5.838669
"5806",3631.912,"NC","Forsyth County","VIENNA VOLUNTEER FIRE DEPARTMENT INC",3.631912
"5807",3338.216,"NC","Forsyth County","SOUTHWEST ATHLETICS INC",3.338216
"5808",2801.381,"NC","Forsyth County","INDEPENDENT ORDER OF ODD FELLOWS",2.801381
"5809",1885.855,"NC","Franklin County","FRANKLINTON FIRE DEPARTMENT INC",1.885855
"5810",886.659,"NC","Franklin County","MITCHINERS CROSS ROAD RURAL FIRE DEPARTMENT INC",0.886659
"5811",33638.346,"NC","Gaston County","MOUNTAIN ISLAND CHARTER SCHOOL SOAR FOUNDATION",33.638346
"5812",31995.224,"NC","Gaston County","HOLY ANGELS FOUNDATION INC",31.995224
"5813",24700.546,"NC","Gaston County","STANLEY TOTAL LIVING CENTER INC",24.700546
"5814",23103.196,"NC","Gaston County","GASTON CHRISTIAN SCHOOLS INC",23.103196
"5815",12267.627,"NC","Gaston County","HOLY ANGELS SERVICES INC",12.267627
"5816",9104.742,"NC","Gaston County","HOLY ANGELS INC",9.104742
"5817",8860.622,"NC","Gaston County","ASPIRE CAROLINAS FOUNDATION INC",8.860622
"5818",5089.964,"NC","Gaston County","STANLEY TOTAL LIVING CENTER FOUNDATION",5.089964
"5819",4171.389,"NC","Gaston County","GASTON RESIDENTIAL SERVICES INC",4.171389
"5820",3302.358,"NC","Gaston County","NOW OUTREACH",3.302358
"5821",1772.878,"NC","Graham County","ETERNAL TRUTH MINISTRIES",1.772878
"5822",757.86,"NC","Graham County","THE GLEANINGS FOUNDATION",0.75786
"5823",706.884,"NC","Granville County","UPPER NEUSE RIVER BASIN ASSOCIATION INC",0.706884
"5824",236.422,"NC","Granville County","AREA CONGREGATIONS IN MINISTRY",0.236422
"5825",160.204,"NC","Granville County","STEM COMMUNITY FIRE DEPARTMENT AND EMS INC",0.160204
"5826",138.683,"NC","Granville County","OXFORD ORPHANAGE-MASONIC HOME FOR CHILDREN AT OXFORD ALUMNI",0.138683
"5827",1750.175,"NC","Greene County","SNOW HILL RURAL FIRE DEPARTMENT INC",1.750175
"5828",83.191,"NC","Greene County","NORTH CAROLINA HIGH SCHOOL AND JUNIOR HIGH RODEO ASSOCATION",0.083191
"5829",369290.686,"NC","Guilford County","UNIVERSITY OF NORTH CAROLINA AT GREENSBORO INVESTMENT FUND INC",369.290686
"5830",204449.008,"NC","Guilford County","FRIENDS HOMES INC",204.449008
"5831",187420.574,"NC","Guilford County","UNC-G EXCELLENCE FOUNDATION",187.420574
"5832",75933.688,"NC","Guilford County","GATEWAY RESEARCH PARK INC",75.933688
"5833",49577.577,"NC","Guilford County","GOODWILL INDUSTRIES OF CENTRAL NORTH CAROLINA INC",49.577577
"5834",24393.851,"NC","Guilford County","UNIVERSITY OF NORTH CAROLINA AT GREENSBORO WEATHERSPOON ARTS FOUND",24.393851
"5835",23163.847,"NC","Guilford County","CHILDRENS HOME SOCIETY FOUNDATION INC",23.163847
"5836",22564.161,"NC","Guilford County","CHILDRENS HOME SOCIETY OF NORTH CAROLINA INC",22.564161
"5837",21963.26,"NC","Guilford County","CAPITAL FACILITIES FOUNDATION INC",21.96326
"5838",19064.635,"NC","Guilford County","PIEDMONT LAND CONSERVANCY",19.064635
"5839",2925.619,"NC","Halifax County","HALIFAX ACADEMY A CHRISTIAN SCHOOL INC",2.925619
"5840",1850.835,"NC","Halifax County","RHEASVILLE VOLUNTEER FIRE DEPARTMENT",1.850835
"5841",873.931,"NC","Halifax County","HABITAT FOR HUMANITY INTERNATIONAL INC",0.873931
"5842",262.099,"NC","Halifax County","HALIFAX FIRE AND RESCUE DEPARTMENT",0.262099
"5843",243.755,"NC","Halifax County","ROANOKE VALLEY ADULT DAY CARE CENTER INC",0.243755
"5844",175.541,"NC","Halifax County","HANNAHS PLACE INC",0.175541
"5845",102.141,"NC","Halifax County","NORTH CAROLINA SAFETY CONFERENCE INC",0.102141
"5846",59.669,"NC","Halifax County","HOBGOOD ACADEMY INC",0.059669
"5847",7347.281,"NC","Harnett County","NORTHWEST HARNETT VOLUNTARY FIRE DEPARTMENT INC",7.347281
"5848",5001.04,"NC","Harnett County","DUNN EMERGENCY SERVICES INC",5.00104
"5849",4915.88,"NC","Harnett County","SPOUT SPRINGS EMERGENCY SERVICES INC",4.91588
"5850",3884.183,"NC","Harnett County","ANGIER & BLACK RIVER FIRE DEPARTMENT INC",3.884183
"5851",2835.731,"NC","Harnett County","BENHAVEN EMERGENCY SERVICES INC",2.835731
"5852",2716.094,"NC","Harnett County","BOONE TRAIL EMERGENCY SERVICES INC",2.716094
"5853",2329.242,"NC","Harnett County","SUMMERVILLE BUNNLEVEL FIRE & RESCUE INC",2.329242
"5854",2233.598,"NC","Harnett County","ERWIN FIRE DEPARTMENT AND RESCUE SQUAD INC",2.233598
"5855",1895.031,"NC","Harnett County","FLAT BRANCH VOLUNTEER FIRE DEPT",1.895031
"5856",1477.487,"NC","Harnett County","THE GENERAL WILLIAM C LEE MEMORIAL COMMISSION INC",1.477487
"5857",19303.738,"NC","Haywood County","HAYWOOD VOCATIONAL OPPORTUNITIES INC",19.303738
"5858",15571.052,"NC","Haywood County","HAYWOOD COMMUNITY COLLEGE FOUNDATION INCORPORATED",15.571052
"5859",11961.611,"NC","Haywood County","MOUNTAIN PROJECTS INC",11.961611
"5860",4814.317,"NC","Haywood County","ARC OF HAYWOOD COUNTY INC",4.814317
"5861",4235.904,"NC","Haywood County","MOUNTAIN VIEW HOUSING INC",4.235904
"5862",3626.879,"NC","Haywood County","HAYWOOD CHRISTIAN ACADEMY INC",3.626879
"5863",2668.384,"NC","Haywood County","HABITAT FOR HUMANITY INTERNATIONAL INC",2.668384
"5864",892.185,"NC","Haywood County","UNITED WAY OF HAYWOOD COUNTY INC",0.892185
"5865",799.064,"NC","Haywood County","REACH OF HAYWOOD COUNTY INC",0.799064
"5866",324.648,"NC","Haywood County","HAYWOOD COUNTY ARTS COUNCIL INC",0.324648
"5867",129083.654,"NC","Henderson County","CAROLINA VILLAGE INC",129.083654
"5868",121395.555,"NC","Henderson County","COMMUNITY FOUNDATION OF HENDERSON COUNTY INC",121.395555
"5869",42801.34,"NC","Henderson County","BLUE RIDGE COMMUNITY HEALTH SERVICES INC",42.80134
"5870",20458.785,"NC","Henderson County","MILLS RIVER VOLUNTEER FIRE DEPARTMENT INC",20.458785
"5871",6606.459,"NC","Henderson County","MINISTRY SEVEN",6.606459
"5872",4059.001,"NC","Henderson County","MOUNTAIN HOME FIRE & RESCUE DEPT INC",4.059001
"5873",3345.358,"NC","Henderson County","PARDEE MEMORIAL HOSPITAL FOUNDATION INC",3.345358
"5874",2921.714,"NC","Henderson County","ETOWAH-HORSESHOE VOLUNTEER FIRE & RESCUE DEPARTMENT INC",2.921714
"5875",2535.443,"NC","Henderson County","DANA VOLUNTEER FIRE DEPARTMENT INC",2.535443
"5876",2164.612,"NC","Henderson County","CHILDREN & FAMILY RESOURCE CENTER OF HENDERSON COUNTY INC",2.164612
"5877",1003.684,"NC","Hertford County","MEHERRIN INDIAN TRIBE",1.003684
"5878",466.358,"NC","Hertford County","COMO VOLUNTEER FIRE COMPANY INC",0.466358
"5879",428.887,"NC","Hertford County","UNION RURAL FIRE DEPARTMENT OF HERTFORD COUNTY INC",0.428887
"5880",230.987,"NC","Hertford County","PARTNERS FOR HERTFORD COUNTY PUBLIC SCHOOLS",0.230987
"5881",2486.162,"NC","Hoke County","PUPPY CREEK FIRE DEPARTMENT INC",2.486162
"5882",1930.546,"NC","Hoke County","ROCKFISH FIRE DEPARTMENT INC",1.930546
"5883",1718.252,"NC","Hoke County","PARTNERS FOR HOKE COUNTY PUBLIC SCHOOLS EDUCATION FOUNDATION",1.718252
"5884",1533.251,"NC","Hoke County","HILLCREST FIRE DEPARTMENT",1.533251
"5885",625.061,"NC","Hoke County","HOKE CO ASSOCIATION FOR THE DEVELOPMENTALLY DISABLED INC",0.625061
"5886",613.222,"NC","Hoke County","RAEFORD-HOKE MUSEUM INC",0.613222
"5887",117.829,"NC","Hoke County","HOKE DOMESTIC VIOLENCE & SEXUAL ASSUALT CENTER INC",0.117829
"5888",36.342,"NC","Hoke County","HOKE COUNTY READING-LITERACY COUNCIL INC",0.036342
"5889",996.883,"NC","Hyde County","HYDE COUNTY NON PROFIT PRIVATE TRANSPORTATION CORPORATION",0.996883
"5890",274.836,"NC","Hyde County","HYDE COUNTY HOTLINE",0.274836
"5891",18802.67,"NC","Iredell County","LOWES FOUNDATION",18.80267
