"2797",981.214,"IL","McHenry County","MARENGO AREA SCHOOLS EDUCATION FOUNDATION INC",0.981214
"2798",96396.139,"IL","McLean County","WESTMINSTER VILLAGE INC",96.396139
"2799",17410.833,"IL","McLean County","MCLEAN COUNTY HISTORICAL SOCIETY",17.410833
"2800",16682.439,"IL","McLean County","HEARTLAND COMMUNITY COLLEGE FOUNDATION",16.682439
"2801",10461.969,"IL","McLean County","ILLINOIS HIGH SCHOOL ASSOCIATION",10.461969
"2802",10195.503,"IL","McLean County","HOME SWEET HOME MINISTRIES INC",10.195503
"2803",10112.273,"IL","McLean County","ILLINOIS NETWORK OF CHILD CARE RESOURCE AND REFERRAL AGENCIES",10.112273
"2804",9608.066,"IL","McLean County","MARCFIRST",9.608066
"2805",8655.268,"IL","McLean County","CORNERSTONE CHRISTIAN ACADEMY OF MCLEAN COUNTY INC",8.655268
"2806",6115.087,"IL","McLean County","PARKLANDS FOUNDATION",6.115087
"2807",4588.488,"IL","McLean County","HUMANE SOCIETY OF CENTRAL ILLINOIS",4.588488
"2808",701.738,"IL","Menard County","ATHENS AREA FOOD PANTRY",0.701738
"2809",755.407,"IL","Mercer County","MERCER COUNTY FAMILY CRISIS CENTER",0.755407
"2810",206.606,"IL","Mercer County","ALEDO MAIN STREET INC",0.206606
"2811",5635.782,"IL","Monroe County","HUMAN SUPPORT SERVICES",5.635782
"2812",4771.79,"IL","Monroe County","CLIFFTOP NFP",4.77179
"2813",2866.916,"IL","Monroe County","MONROE COUNTY APARTMENTS 4 ASSN",2.866916
"2814",1615.103,"IL","Monroe County","HUMAN SUPPORT SERVICES FOUNDATION",1.615103
"2815",10.84,"IL","Monroe County","EQUUS RESCUE AND THERAPY INC",0.01084
"2816",1385.462,"IL","Montgomery County","LATTER RAIN MINISTRIES INC",1.385462
"2817",641.778,"IL","Montgomery County","CONTINUING RECOVERY CENTER INC",0.641778
"2818",605.182,"IL","Montgomery County","LITCHFIELD MUSEUM & ROUTE 66 WELCOME CENTER",0.605182
"2819",10495.61,"IL","Morgan County","PATHWAY SERVICES UNLIMITED INC",10.49561
"2820",4388.782,"IL","Morgan County","BOB FREESEN YOUNG MENS CHRISTIAN ASSOCIATION",4.388782
"2821",794.865,"IL","Morgan County","MIDWEST YOUTH SERVICES",0.794865
"2822",466.766,"IL","Morgan County","MACMURRAY FOUNDATION & ALUMNI ASSOCIATION NFP",0.466766
"2823",249.417,"IL","Morgan County","JACKSONVILLE COMMUNITY CENTER FOR THE DEAF",0.249417
"2824",816.578,"IL","Moultrie County","SULLIVAN PRESCHOOL",0.816578
"2825",2679.331,"IL","Ogle County","ROCK RIVER CENTER INC",2.679331
"2826",933.197,"IL","Ogle County","HOPE OF OGLE COUNTY",0.933197
"2827",792.144,"IL","Ogle County","POLO LIBRAARY FOUNDATION NFPN",0.792144
"2828",32746.473,"IL","Peoria County","PEORIA PRODUCTION SHOP INC",32.746473
"2829",13482.889,"IL","Peoria County","PEORIA RIVERFRONT MUSEUM",13.482889
"2830",12791.666,"IL","Peoria County","FRIENDS OF WILDLIFE PRAIRIE PARK",12.791666
"2831",12471.154,"IL","Peoria County","OPERATING ENGINEERS APPRENTICESHIP TRUST FUND LOCAL 649",12.471154
"2832",11624.793,"IL","Peoria County","PEORIA RIVERFRONT MUSEUM FOUNDATION",11.624793
"2833",8942.098,"IL","Peoria County","COMMUNITY WORKSHOP & TRAINING CENTER INC",8.942098
"2834",6522.427,"IL","Peoria County","CRITTENTON CENTERS",6.522427
"2835",3863.351,"IL","Peoria County","COUNSELING & FAMILY SERVICES OF PEORIA IL INC",3.863351
"2836",1219.345,"IL","Peoria County","PEORIA SCHOOL DISTRICT 150 FOUNDATION",1.219345
"2837",1179.887,"IL","Peoria County","LIFELINE INC",1.179887
"2838",720.743,"IL","Perry County","CARING AND SHARING THRIFT SHOP NFP",0.720743
"2839",479.221,"IL","Perry County","SACRED HEART DU QUOIN EDUCATION FOUNDATION",0.479221
"2840",212.065,"IL","Perry County","DUQUOIN BOYS CLUB INC",0.212065
"2841",139.74,"IL","Perry County","PERRY-JACKSON CHILD ADVOCACY CENTER",0.13974
"2842",1790.613,"IL","Piatt County","EVA TATMAN TRUST",1.790613
"2843",858.663,"IL","Piatt County","HABITAT FOR HUMANITY INTERNATIONAL INC",0.858663
"2844",1685.477,"IL","Pike County","WEST CENTRAL ILLINOIS AGRICULTURAL RESEARCH & DEMONSTRATION CENTER IN",1.685477
"2845",0,"IL","Pike County","QUINCY AREA CHRISTIAN SCHOOLS ASSOCIATION",0
"2846",990.5,"IL","Pope County","POPE COUNTY SENIOR CITIZENS",0.9905
"2847",1653.068,"IL","Putnam County","ILLINOIS P E O HOME",1.653068
"2848",1032.055,"IL","Randolph County","ST CLEMENT COMMUNITY FOUNDATION",1.032055
"2849",157.053,"IL","Randolph County","NORTHEASTERN RANDOLPH COUNTY SENIOR SERVICES INC",0.157053
"2850",3701.743,"IL","Richland County","OLNEY CENTRAL COLLEGE FOUNDATION",3.701743
"2851",811.493,"IL","Richland County","RICHLAND HERITAGE MUSEUM FOUNDATION",0.811493
"2852",467.72,"IL","Richland County","PROJECT COMMUNITY INC",0.46772
"2853",4038.701,"IL","Rock Island County","FREE ENTERPRISE FOUNDATION INC",4.038701
"2854",3109.48,"IL","Rock Island County","THE PROJECT OF THE QUAD CITIES",3.10948
"2855",2876.143,"IL","Rock Island County","JUNIOR ACHIEVEMENT OF THE HEARTLAND",2.876143
"2856",2169.166,"IL","Rock Island County","EVERY CHILD",2.169166
"2857",671.564,"IL","Rock Island County","ROCK ISLAND COUNTY CHILDRENS ADVOCACY CENTER",0.671564
"2858",384.04,"IL","Rock Island County","THE QUAD CITY HITMEN BASEBALL ASSOCIATION",0.38404
"2859",49404.441,"IL","Sangamon County","ILLINOIS AUDUBON SOCIETY",49.404441
"2860",32068.495,"IL","Sangamon County","LINCOLN PRESIDENTIAL FOUNDATION",32.068495
"2861",25675.909,"IL","Sangamon County","LINCOLN LAND COMMUNITY COLLEGE FOUNDATION",25.675909
"2862",25160.938,"IL","Sangamon County","CENTRAL COUNTIES HEALTH CENTERS INC",25.160938
"2863",22283.983,"IL","Sangamon County","ILLINOIS ASSOCIATION OF SCHOOL BOARDS",22.283983
"2864",13682.553,"IL","Sangamon County","CENTRAL ILLINOIS FOODBANK",13.682553
"2865",7337.222,"IL","Sangamon County","ILLINOIS COALITION AGAINST SEXUAL ASSAULT",7.337222
"2866",7187.243,"IL","Sangamon County","ILLINOIS ELKS CHILDRENS CARE CORPORATION",7.187243
"2867",7159.476,"IL","Sangamon County","ST JOSEPHS HOME OF SPRINGFIELD",7.159476
"2868",6170.291,"IL","Sangamon County","THE SANGAMON CONSERVANCY TR",6.170291
"2869",307.619,"IL","Schuyler County","SCHUYLER COUNTY MENTAL HEALTH ASSOCIATION",0.307619
"2870",96.451,"IL","Scott County","CHOSEN FRIENDS OF THE FAMILY",0.096451
"2871",5053.184,"IL","St. Clair County","VIOLENCE PREVENTION CENTER OF SOUTHWESTERN ILLINOIS",5.053184
"2872",3197.425,"IL","St. Clair County","CEREBRAL PALSY OF SOUTHWESTERN ILLINOIS",3.197425
"2873",2928.9,"IL","St. Clair County","THE ILLINOIS CENTER FOR AUTISM",2.9289
"2874",2901.505,"IL","St. Clair County","CATHOLIC URBAN PROGRAMS NFP",2.901505
"2875",2152.594,"IL","St. Clair County","THE ILLINOIS AUTISM DEVELOPMENT CENTER",2.152594
"2876",2113.425,"IL","St. Clair County","SOUTHWESTERN ILLINOIS LAW ENFORCEMENT COMMISSION",2.113425
"2877",2015.765,"IL","St. Clair County","EPILEPSY FOUNDATION OF GREATER SOUTHERN ILLINOIS",2.015765
"2878",1490.607,"IL","St. Clair County","FOUNDATION FOR MASCOUTAH SCHOOLS INC",1.490607
"2879",1468.928,"IL","St. Clair County","BELLEVILLE AREA HUMANE SOCIETY",1.468928
"2880",1360.501,"IL","St. Clair County","THE EAGLES NEST ST CLAIR COUNTY",1.360501
"2881",236.312,"IL","Stark County","HEARTLAND PRIVATE SCHOOL INC",0.236312
"2882",1617.368,"IL","Stephenson County","NORMAN C SLEEZER YOUTH HOME",1.617368
"2883",1196.047,"IL","Stephenson County","ASSOCIATION OF CHRISTAIN TEACHERS & SCHOOLS",1.196047
"2884",727.03,"IL","Stephenson County","NORTHWEST ILLINOIS AUDUBON SOCIETY INC",0.72703
"2885",187.907,"IL","Stephenson County","LENA-WINSLOW EDUCATION FOUNDATION",0.187907
"2886",47503.86,"IL","Tazewell County","APOSTOLIC CHRISTIAN LIFEPOINTS INC",47.50386
"2887",2523.979,"IL","Tazewell County","WASHINGTON VOLUNTEER FIRE DEPARTMENT AND RESCUE SQUAD INC",2.523979
"2888",2487.223,"IL","Tazewell County","ASSOCIATION OF ILLINOIS SCHOOL LIBRARY EDUCATORS",2.487223
"2889",842.271,"IL","Tazewell County","WASHINGTON HISTORICAL SOCIETY",0.842271
"2890",636.143,"IL","Tazewell County","UNITED WAY OF PEKIN",0.636143
"2891",613.119,"IL","Tazewell County","JUNIOR ACHIEVEMENT OF CENTRAL ILLINOIS",0.613119
"2892",204.41,"IL","Tazewell County","PARENT BOOSTER USA INC",0.20441
"2893",170.674,"IL","Tazewell County","TAZEWELL COUNTY HEADSTART PROGRAM",0.170674
"2894",442.405,"IL","Union County","TWO RIVERS CHILD ADVOCACY CENTER",0.442405
"2895",22402.076,"IL","Vermilion County","DANVILLE AREA COMMUNITY COLLEGE FOUNDATION INC",22.402076
"2896",3409.493,"IL","Vermilion County","DANVILLE PUBLIC SCHOOL FOUNDATION INC",3.409493
"2897",892.777,"IL","Vermilion County","PROJECT SUCCESS OF VERMILION COUNTY INC",0.892777
"2898",605.047,"IL","Vermilion County","HELP MINISTRIES INC",0.605047
"2899",442.367,"IL","Vermilion County","BIOCHEMISTRY TRUST OF URBANA ILLINOIS",0.442367
"2900",329.771,"IL","Vermilion County","NEW DIRECTIONS TREATMENT CENTER",0.329771
"2901",21.165,"IL","Vermilion County","DANVILLE HIGH SCHOOL CHORAL MUSIC BOOSTERS INC",0.021165
"2902",864.442,"IL","Wabash County","WABASH COUNTY ANIMAL SHELTER BUDDIES",0.864442
"2903",7678.361,"IL","Warren County","ACHIEVEMENT CENTER ENDOWMENT FUND INC",7.678361
"2904",1002.76,"IL","Warren County","PRAIRIE ACHIEVEMENT CENTER",1.00276
"2905",920.326,"IL","Warren County","STRONG FOUNDATIONS INC",0.920326
"2906",880.424,"IL","Warren County","ALEXIS NORTH HENDERSON AMBULANCE SERVICE",0.880424
"2907",711.521,"IL","Warren County","MAPLEWAY ACHIEVEMENT CENTER",0.711521
"2908",1453.368,"IL","Washington County","WASHINGTON COUNTY VOCATIONAL WORKSHOP",1.453368
"2909",906.568,"IL","Wayne County","ILLINOIS ELKS ASSOCIATION CHARITABLE TRUST",0.906568
"2910",141.604,"IL","Wayne County","WAYNE COUNTY 4-H FOUNDATION INC",0.141604
"2911",77.602,"IL","White County","WHITE COUNTY EXTENSION SUPPORT COMMITTEE",0.077602
"2912",8111.517,"IL","Whiteside County","CGH HEALTH FOUNDATION",8.111517
"2913",4955.168,"IL","Whiteside County","UNITY CHRISTIAN SCHOOL",4.955168
"2914",3238.33,"IL","Whiteside County","MORRISON INSTITUTE OF TECHNOLOGY",3.23833
"2915",1509.216,"IL","Whiteside County","STERLING PARK DISTRICT MUSEUM ASSOCIATION STERLING PARK DISTRICT",1.509216
"2916",1205.384,"IL","Whiteside County","RIVER BEND EDUCATIONAL FOUNDATION",1.205384
"2917",823.084,"IL","Whiteside County","JAMES CRANGLE FOUNDATION",0.823084
"2918",194.689,"IL","Whiteside County","WHITESIDE COUNTY SOIL WATER CONSERV & EDUCATION FUND INC",0.194689
"2919",144.735,"IL","Whiteside County","CGH MEDICAL CENTER AUXILIARY",0.144735
"2920",101829.678,"IL","Will County","UNIVERSITY OF ST FRANCIS",101.829678
"2921",95908.789,"IL","Will County","WASHINGTON & JANE SMITH COMMUNITY- ORLAND PARK",95.908789
"2922",33588.956,"IL","Will County","JOLIET JUNIOR COLLEGE FOUNDATION",33.588956
"2923",15071.7,"IL","Will County","ILLINOIS SCOTTISH RITE FUND",15.0717
"2924",10255.237,"IL","Will County","ULTA BEAUTY CHARITABLE FOUNDATION",10.255237
"2925",9719.425,"IL","Will County","TRINITY CHRISTIAN SCHOOL",9.719425
"2926",7371.343,"IL","Will County","WILL COUNTY HOUSING DEVELOPMENTCORPORATION NFP",7.371343
"2927",5240.269,"IL","Will County","SERVICE INC OF ILLINOIS",5.240269
"2928",5167.721,"IL","Will County","GREEN PINES ACADEMY",5.167721
"2929",4098.713,"IL","Will County","JACOB BLAKE MANOR LTD",4.098713
"2930",3471.238,"IL","Williamson County","OUR LADY OF MOUNT CARMEL-ST MARYS SCHOOL EDUCATION FOUNDATION",3.471238
"2931",3377.912,"IL","Williamson County","REGIONAL ECONOMIC DEVELOPMENT CORPORATION",3.377912
"2932",2521.567,"IL","Williamson County","AGAPE CHRISTIAN HIGH SCHOOL",2.521567
"2933",1914.437,"IL","Williamson County","SOUTHERN ILLINOIS COALITION FOR THE HOMELESS",1.914437
"2934",1283.312,"IL","Williamson County","UNITY CHRISTIAN SCHOOL",1.283312
"2935",1148.417,"IL","Williamson County","MANAGEMENT TRAINING & CONSULTING CORPORATION",1.148417
"2936",728.858,"IL","Williamson County","HERRIN EDUCATION FOUNDATION",0.728858
"2937",546.176,"IL","Williamson County","CHILDRENS ADVOCACY AND ENLIGHTMENT INC",0.546176
"2938",381.55,"IL","Williamson County","FINDING FOREVER ANIMAL RESCUE",0.38155
"2939",329.955,"IL","Williamson County","BELIEVERS VOICE NETWORK",0.329955
"2940",113006.905,"IL","Winnebago County","WILLOWS COTTAGES",113.006905
"2941",42815.501,"IL","Winnebago County","WESLEY WILLOWS A METHODIST RETIREMENT HOME",42.815501
"2942",19868.674,"IL","Winnebago County","NORTH ROCKFORD CONVALESCENT HOME",19.868674
"2943",12288.907,"IL","Winnebago County","NORTHERN ILLINOIS BLOOD BANK INC",12.288907
"2944",9055.491,"IL","Winnebago County","CENTER FOR SIGHT & HEARING",9.055491
"2945",8194.905,"IL","Winnebago County","GALAPAGOS ROCKFORD CHARTER SCHOOL NFP INC",8.194905
"2946",6464.12,"IL","Winnebago County","BARBARA OLSON CENTER OF HOPE",6.46412
"2947",4478.084,"IL","Winnebago County","REGIONAL ACCESS MOBILIZATION PROJECT INC",4.478084
"2948",4115.407,"IL","Winnebago County","KEITH COUNTRY DAY SCHOOL",4.115407
"2949",3434.529,"IL","Winnebago County","WILLOWS HEALTH CENTER",3.434529
"2950",1940.693,"IL","Woodford County","ASSOCIATION FOR THE DEVELOPMENTALLY DISABLED OF WOODFORD COUNTY",1.940693
"2951",36821.357,"IN","Adams County","SWISS VILLAGE INC",36.821357
"2952",771.474,"IN","Adams County","UNITED WAY OF ADAMS COUNTY INDIANA INC",0.771474
"2953",128672.353,"IN","Allen County","UNIVERSITY OF SAINT FRANCIS OF FORT WAYNE INDIANA INC",128.672353
"2954",23282.294,"IN","Allen County","ALLEN COUNTY PUBLIC LIBRARY FOUNDATION",23.282294
"2955",20849.12,"IN","Allen County","CONCORDIA EDUCATION FOUNDATION INC",20.84912
"2956",19448.008,"IN","Allen County","FWRM SUPPORT CORPORATION",19.448008
"2957",19415.45,"IN","Allen County","THE FORT WAYNE RESCUE MISSION MINISTRIES INC",19.41545
"2958",16954.672,"IN","Allen County","JUNIOR ACHIEVEMENT OF NORTHERN INDIANA FOUNDATION INC",16.954672
"2959",15839.94,"IN","Allen County","COMMUNITY HARVEST FOOD BANK OF NORTHEAST INDIANA INC",15.83994
"2960",14143.825,"IN","Allen County","FORT WAYNE MUSEUM OF ART INC",14.143825
"2961",10905.837,"IN","Allen County","JUNIOR ACHIEVEMENT OF NORTHERN INDIANA",10.905837
"2962",7535.301,"IN","Allen County","SCIENCE CENTRAL INC",7.535301
"2963",709.34,"IN","Bartholomew County","DOGWOOD PLACE INC",0.70934
"2964",639.3,"IN","Bartholomew County","PINEVIEW INC",0.6393
"2965",631.612,"IN","Bartholomew County","WILLOWVIEW INC",0.631612
"2966",574.61,"IN","Bartholomew County","CEDAR VIEW INC",0.57461
"2967",427.453,"IN","Bartholomew County","MAPLEVIEW INC",0.427453
"2968",403.333,"IN","Bartholomew County","COLUMBUS EXPRESS SOCCER CLUB INC",0.403333
"2969",148.563,"IN","Bartholomew County","INDIANA HOUSE INC",0.148563
"2970",119.208,"IN","Bartholomew County","ASPEN HOUSE INC",0.119208
"2971",18268.077,"IN","Boone County","INTERACTIVE ACADEMY INC",18.268077
"2972",711.603,"IN","Boone County","ACCESS HOUSING OF WHITE COUNTY INC",0.711603
"2973",578.114,"IN","Boone County","AMERICAN COLLEGE OF PHYSICIANS",0.578114
"2974",558.41,"IN","Boone County","ACCESS HOUSING OF JASPER COUNTY INC",0.55841
"2975",486.456,"IN","Boone County","ACCESS HOUSING OF CARROLL COUNTY INC",0.486456
"2976",394.508,"IN","Boone County","ACCESS HOUSING OF NEWTON COUNTY INC",0.394508
"2977",3270.446,"IN","Carroll County","CARROLL EDUCATION FOUNDATION INC",3.270446
"2978",786.524,"IN","Cass County","CASS COUNTY 4-H CLUB ASSOCIATION INC",0.786524
"2979",621.036,"IN","Cass County","CASS COUNTY CAROUSEL INC",0.621036
"2980",81.413,"IN","Cass County","YOUTH SERVICES ALLIANCE INC",0.081413
"2981",36519.098,"IN","Clark County","JEHOVAH-JIREH FOUNDATION INC",36.519098
"2982",1666.357,"IN","Clark County","CLARK COUNTY YOUTH SHELTER AND FAMILY SERVICES INC",1.666357
"2983",495.025,"IN","Clark County","GCCS EDUCATIONAL FOUNDATION INC",0.495025
"2984",8049.951,"IN","Clinton County","MILNER COMMUNITY HEALTH CARE INC",8.049951
"2985",1370.751,"IN","DeKalb County","UNITED WAY OF DEKALB COUNTY INC",1.370751
"2986",878.743,"IN","DeKalb County","HABITAT FOR HUMANITY INTERNATIONAL INC",0.878743
"2987",226.088,"IN","DeKalb County","HOOSIERS FEEDING THE HUNGRY INC",0.226088
"2988",231.628,"IN","Dearborn County","DEARBORN COUNTY SOCIAL COUNCIL INC",0.231628
"2989",2800.089,"IN","Decatur County","GREENSBURG SENIOR HOUSING CORPORATION",2.800089
"2990",1230.12,"IN","Decatur County","CLARKSBURG COMMUNITY VOLUNTEER FIRE DEPT",1.23012
"2991",556.913,"IN","Decatur County","A41 INC",0.556913
"2992",23080.839,"IN","Delaware County","WESTMINSTER VILLAGE MUNCIE INC",23.080839
"2993",1134.098,"IN","Delaware County","L T C INC",1.134098
"2994",1066.365,"IN","Delaware County","PSI IOTA XI CHARITIES INC",1.066365
"2995",419.676,"IN","Delaware County","MUNCIE ALTRUSA FOUNDATION INC",0.419676
"2996",312.967,"IN","Delaware County","LT C-II INC",0.312967
"2997",184.193,"IN","Delaware County","HELPING HANDS UNLIMITED",0.184193
"2998",58.984,"IN","Delaware County","YOUTH FOR CHRIST USA INC",0.058984
"2999",155.295,"IN","Dubois County","JASPER BAND PARENTS INC",0.155295
"3000",65599.227,"IN","Elkhart County","CHURCH WORLD SERVICE INC",65.599227
"3001",38543.404,"IN","Elkhart County","ADEC INC",38.543404
"3002",15456.301,"IN","Elkhart County","BETHANY CHRISTIAN SCHOOLS INC",15.456301
"3003",6946.622,"IN","Elkhart County","TRANSFORMATION MINISTRIES INC",6.946622
"3004",5906.798,"IN","Elkhart County","INTERFAITH HOUSING CORPORATION",5.906798
"3005",1736.421,"IN","Elkhart County","COMMUNITY CHAPLAINCY CORPORATION OF ELKHART COUNTY",1.736421
"3006",1543.492,"IN","Elkhart County","LEADERSTREAM INC",1.543492
"3007",1126.728,"IN","Elkhart County","SOUTH BEND MICHIANA ASSOCIATION OF PIANO TEACHERS",1.126728
"3008",1100.721,"IN","Elkhart County","CORNERSTONE CHRISTIAN MONTESSORI",1.100721
"3009",788.571,"IN","Elkhart County","MONTESSORI SCHOOL OF ELKHART INC",0.788571
"3010",526.78,"IN","Fayette County","FAYETTE COUNTY FREE FAIR ASSOCIATION INC",0.52678
"3011",137.757,"IN","Fayette County","CONNERSVILLE URBAN ENTERPRISE ASSOCIATION INC",0.137757
"3012",4673.161,"IN","Floyd County","FLOYD COUNTY COMMUNITY ACTION",4.673161
"3013",21.651,"IN","Floyd County","INDIANA HIGH SCHOOL RODEO ASSOCIATION",0.021651
"3014",777.749,"IN","Gibson County","UNITED WAY OF GIBSON COUNTY INC",0.777749
"3015",572069.015,"IN","Grant County","INDIANA WESLEYAN UNIVERSITY",572.069015
"3016",799.029,"IN","Grant County","WESLEYAN RETIREMENT CENTER INC",0.799029
"3017",676.589,"IN","Grant County","KIDZMATTER",0.676589
"3018",536.61,"IN","Grant County","BLACKFORD-GRANT HUD IV",0.53661
"3019",482.006,"IN","Grant County","BLACKFORD-GRANT HUD II INC",0.482006
"3020",468.58,"IN","Grant County","LEADERSHIP EDUCATION AND DEVELOPMENT INC",0.46858
"3021",371.395,"IN","Grant County","BLACKFORD GRANT HOUSING AUTHORITY INC",0.371395
"3022",0.589,"IN","Grant County","GENESIS PLACE INC",0.000589
"3023",9369.444,"IN","Hamilton County","SIGMA KAPPA FOUNDATION INC",9.369444
"3024",4043.443,"IN","Hamilton County","ACACIA FRATERNITY FOUNDATION INC",4.043443
"3025",3210.158,"IN","Hamilton County","INDY LATIN SCHOOL ASSOCIATION INC",3.210158
"3026",2075.108,"IN","Hamilton County","HAMILTON SOUTHEASTERN SCHOOLS FOUNDATION INC",2.075108
"3027",1915.578,"IN","Hamilton County","NATIONAL PANHELLENIC CONFERENCE",1.915578
"3028",1825.213,"IN","Hamilton County","CHRISTIAN LEADERS FOR AFRICA INC",1.825213
"3029",1804.262,"IN","Hamilton County","COMMUNITY MONTESSORI SCHOOL INC",1.804262
"3030",1409.111,"IN","Hamilton County","TRINITY FREE CLINIC INC",1.409111
"3031",1325.139,"IN","Hamilton County","CARMEL CHRISTKINDLMARKT INC",1.325139
"3032",1252.79,"IN","Hamilton County","HOOSIER FUTBOL CLUB INC",1.25279
"3033",1170.502,"IN","Hancock County","NATIONAL SOCIETY OF THE DAUGHTERS OF THE AMERICAN REVOLUTION",1.170502
"3034",19.034,"IN","Hancock County","GREENFIELD CENTRAL COMMUNITY SCHOOL BAND BOOSTERS",0.019034
"3035",281.976,"IN","Harrison County","SOUTHERN INDIANA REGIONAL ALLIANCE TO PREVENT EXPLOITATION INC",0.281976
"3036",87662.956,"IN","Hendricks County","CRF AFFORDABLE HOUSING INC",87.662956
"3037",3339.27,"IN","Hendricks County","STONE TABLE INC",3.33927
"3038",1881.929,"IN","Hendricks County","COMMUNITY REINVESTMENT FOUNDATION XII INC",1.881929
"3039",1753.844,"IN","Hendricks County","COMMUNITY REINVESTMENT FOUNDATION X INC",1.753844
"3040",1430.552,"IN","Hendricks County","COMMUNITY REINVESTMENT FOUNDATION- XIV INC",1.430552
"3041",1401.472,"IN","Hendricks County","COMMUNITY REINVESTMENT FOUNDATION INC",1.401472
"3042",1281.061,"IN","Hendricks County","COMMUNITY REINVESTMENT FOUNDATION- XI INC",1.281061
"3043",1154.385,"IN","Hendricks County","COMMUNITY REINVESTMENT FOUNDATION INC",1.154385
"3044",1122.036,"IN","Hendricks County","COMMUNITY REINVESTMENT FOUNDATION XV INC",1.122036
"3045",1022.359,"IN","Hendricks County","CORRECTIONAL PROFESSIONALS ASSISTANCE FUND OF INDIANA INC",1.022359
"3046",1721.388,"IN","Howard County","GOODFELLOWS OF KOKOMO INC",1.721388
"3047",1082.515,"IN","Howard County","ONE 17 INTERNATIONAL INC",1.082515
"3048",968.012,"IN","Howard County","HABITAT FOR HUMANITY OF THE KOKOMO COMMUNITY INC",0.968012
"3049",146.415,"IN","Jackson County","DISTRICT 8 EMERGENCY PREPAREDNESS AND PLANNING COALITION INC",0.146415
"3050",425.197,"IN","Jasper County","JASPER COUNTY INDUSTRIAL FOUNDATION INC",0.425197
"3051",372.663,"IN","Jasper County","LEADING THE EDUCATION ABOUT PIGS FOUNDATION INC",0.372663
"3052",3838.237,"IN","Jay County","JOHN JAY CENTER FOR LEARNING INC",3.838237
"3053",3025.847,"IN","Jay County","JAY COUNTY BOYS CLUB INC",3.025847
"3054",263.785,"IN","Jay County","JAY COUNTY CHRISTIAN HOME BUILDERS INC",0.263785
"3055",63.424,"IN","Jay County","JAY PATRIOT BAND BOOSTERS CORPORATION",0.063424
"3056",5902.641,"IN","Jefferson County","FRIENDS OF SHAWE & POPE JOHN SCHOOLS INC",5.902641
"3057",7485.51,"IN","Johnson County","GREENWOOD CHRISTIAN ACADEMY INC",7.48551
"3058",3476.263,"IN","Johnson County","INDIANA BAPTIST COLLEGE INC",3.476263
"3059",684.022,"IN","Johnson County","THE TABERNACLE CHRISTIAN CHRUCH FOUNDATION OF FRANKLIN INDIANA INC",0.684022
"3060",128.331,"IN","Johnson County","GREENWOOD BAND PARENTS ORGANIZATION INC",0.128331
"3061",44.614,"IN","Johnson County","FRANKLIN COMMUNITY SCHOOLS BAND BOOSTERS INC",0.044614
"3062",35.507,"IN","Johnson County","WHITELAND BAND BOOSTERS INC",0.035507
"3063",118259.845,"IN","Knox County","VINCENNES UNIVERSITY FOUNDATION INC",118.259845
"3064",3363.169,"IN","Knox County","INDIANA MILITARY MUSEUM INC",3.363169
"3065",2076.672,"IN","Knox County","GROUSELAND FOUNDATION INC",2.076672
"3066",1327.816,"IN","Knox County","DISTRICT OF VINCENNES OF THE SOCIETY OF ST VINCENT DE PAUL INC",1.327816
"3067",863.12,"IN","Knox County","SOUTH KNOX EDUCATION FOUNDATION INC",0.86312
"3068",647.766,"IN","Knox County","NATIONAL SOCIETY OF THE DAUGHTERS OF THE AMERICAN REVOLUTION",0.647766
"3069",193.815,"IN","Knox County","CHRISTIAN CAMPUS FELLOWSHIP",0.193815
"3070",85935.849,"IN","Kosciusko County","GRACE SCHOOLS",85.935849
"3071",80469.04,"IN","Kosciusko County","KOSCIUSKO COUNTY COMMUNITY FOUNDATION INC",80.46904
"3072",8126.108,"IN","Kosciusko County","AFFILIATED SERVICE PROVIDERS OF INDIANA INC",8.126108
"3073",2660.441,"IN","Kosciusko County","KOSCIUSKO COUNTY SHELTER FOR ABUSE INC",2.660441
"3074",1385.597,"IN","Kosciusko County","ORTHOPEDICS CAPITAL FOUNDATION INC",1.385597
"3075",984.793,"IN","Kosciusko County","GRACE COMMUNITY EDUCATION INC",0.984793
"3076",94.331,"IN","Kosciusko County","HOUSING OPPORTUNITIES OF WARSAW INDIANA INC",0.094331
"3077",8.098,"IN","Kosciusko County","UNIFIED COACHES ASSOCIATION OF INDIANA",0.008098
"3078",0,"IN","Kosciusko County","HEPHZIBAH HOUSE INC",0
"3079",600.257,"IN","LaGrange County","MENNO-CLINIC INDIA INC",0.600257
"3080",385.779,"IN","LaGrange County","HOWE MILITARY SCHOOL",0.385779
"3081",12304.506,"IN","LaPorte County","LALUMIERE SCHOOL INC",12.304506
"3082",2048.117,"IN","LaPorte County","RENAISSANCE ACADEMY INC",2.048117
"3083",1991.273,"IN","LaPorte County","THE ARC OF NORTHWEST INDIANA INC",1.991273
"3084",1857.566,"IN","LaPorte County","MARQUETTE BOOSTERS CLUB AND FOUNDATION INC",1.857566
"3085",1176.465,"IN","LaPorte County","HABITAT FOR HUMANITY INTERNATIONAL INC",1.176465
"3086",912.931,"IN","LaPorte County","LAPORTE COUNTY AGRICULTURAL ASSOCIATION",0.912931
"3087",615.434,"IN","LaPorte County","LA PORTE SYMPHONY ORCHESTRA INC",0.615434
"3088",358.658,"IN","LaPorte County","SOCIAL AND LEARNING INSTITUTE INCORPORATED",0.358658
"3089",258.342,"IN","LaPorte County","SERVICE LEAGUE OF MICHIGAN CITY INDIANA INC",0.258342
"3090",170.588,"IN","LaPorte County","RURAL SERVICES OF INDIANA",0.170588
"3091",43687.033,"IN","Lake County","ILLIANA CHRISTIAN HIGH SCHOOL",43.687033
"3092",18829.678,"IN","Lake County","CROWN POINT CHRISTIAN SCHOOL ASSOCIATION INC",18.829678
"3093",15622.131,"IN","Lake County","TRADEWINDS SERVICES INC",15.622131
"3094",11083.474,"IN","Lake County","MID-AMERICA REFORMED SEMINARY",11.083474
"3095",9886.018,"IN","Lake County","ASSOCIATION FOR PROTESTANT REFORMED EDUCATION",9.886018
"3096",3867.9,"IN","Lake County","HYLES-ANDERSON COLLEGE INC",3.8679
"3097",3584.698,"IN","Lake County","BISHOP NOLL INSTITUTE FOUNDATION INC",3.584698
"3098",2310.217,"IN","Lake County","PROVIDENCE CHRISTIAN ACADEMY ASSOCIATION INC",2.310217
"3099",2121.103,"IN","Lake County","SECOND LIFE RESALE SHOPPE INC",2.121103
"3100",1833.043,"IN","Lake County","CHALLENGER LEARNING CENTER OF NORTHWEST INDIANA INC",1.833043
"3101",11463.687,"IN","Lawrence County","BEDFORD NORTH LAWRENCE SCHOLARSHIP FOUNDATION INC",11.463687
"3102",36311.474,"IN","Madison County","FLAGSHIP ENTERPRISE CENTER INC",36.311474
"3103",3871.296,"IN","Madison County","LIBERTY CHRISTIAN SCHOOL INC",3.871296
"3104",2642.983,"IN","Madison County","PARAMOUNT HERITAGE FOUNDATION INC",2.642983
"3105",1621.789,"IN","Madison County","FLAGSHIP ENTERPRISE CAPITAL",1.621789
"3106",413.411,"IN","Madison County","INDIANA CHRISTIAN ACADEMY OF ANDERSON INDIANA INC",0.413411
